,title,mag_name,mag_classn,mag_city,mag_city_code,author_first,author_unit_first,unit_city,unit_city_code,coauthor,ym,class_num
4373,个人理财业务中银行和客户的义务配置——基于产品和契约类型差异性的分析框架,金融论坛,经济与管理,北京市,1100,郭雳,北京大学,北京市,1100.0, 温馨,2010-07-01,F
4374,股权结构对中国商业银行效率的影响,金融论坛,经济与管理,北京市,1100,何蛟,重庆大学,重庆市,5000.0, 傅强; 潘璐,2010-07-01,F;F;F
4377,国家市场经济与金融危机,金融论坛,经济与管理,北京市,1100,坂本正,熊本学园大学,国外,9000.0,,2010-07-01,F;F
4382,限额存款保险与中国银行业的市场约束,金融论坛,经济与管理,北京市,1100,马草原,南开大学,天津市,1200.0, 李运达,2010-08-01,F;F;F
4383,我国商业银行碳金融实践的现状评价与发展对策,金融论坛,经济与管理,北京市,1100,翁清云,东北财经大学,大连市,2102.0, 刘丽巍,2010-09-01,F;F
4384,构建我国商业银行碳金融内部风险管理长效机制,金融论坛,经济与管理,北京市,1100,史晓琳,中国社会科学院,北京市,1100.0,,2010-09-01,F
4387,碳金融的发展与我国商业银行碳金融业务模式研究,金融论坛,经济与管理,北京市,1100,王俊,安徽财经大学,蚌埠市,3403.0, 王刚贞,2010-09-01,F;F
4388,后金融危机时代我国商业银行碳金融发展策略,金融论坛,经济与管理,北京市,1100,武魏巍,郑州大学,郑州市,4101.0,,2010-09-01,F;F
4389,浅论我国碳银行业务经营管理,金融论坛,经济与管理,北京市,1100,邵伟,中国银行,北京市,1100.0,,2010-09-01,F;F
4393,大型银行与股份制银行存贷利差比较研究,金融论坛,经济与管理,北京市,1100,何自云,对外经济贸易大学,北京市,1100.0,,2010-09-01,F;F
4395,商业银行房地产信贷业务的风险与控制,金融论坛,经济与管理,北京市,1100,匡小平,江西财经大学,南昌市,3601.0, 苏南宏,2010-09-01,F
4396,特许权价值、公司治理机制和商业银行风险承担,金融论坛,经济与管理,北京市,1100,曹廷求,山东大学,济南市,3701.0, 王营,2010-10-01,F
4397,利益相关者关系与商业银行经营绩效的相关性,金融论坛,经济与管理,北京市,1100,纪建悦,中国海洋大学,青岛市,3702.0, 李坤,2010-10-01,F
4399,城市商业银行跨区域经营模式分析,金融论坛,经济与管理,北京市,1100,周好文,西安交通大学,西安市,6101.0, 刘飞,2010-10-01,F
4400,汇率变动对银行业经营绩效的影响,金融论坛,经济与管理,北京市,1100,陈晓莉,山东大学,济南市,3701.0, 杨杨,2010-11-01,F;F;F
4402,个人抵押贷款违约的相关性因素——基于Copula模型的研究,金融论坛,经济与管理,北京市,1100,王鹰翔,西安交通大学,西安市,6101.0, 王瑞峰,2010-11-01,F
4405,微型企业信贷违约风险的影响因素——对安徽省亳州市农村信用社的调查,金融论坛,经济与管理,北京市,1100,马宇,山东工商学院,烟台市,3706.0,,2010-11-01,F
4407,中国商业银行市场势力对其效率和稳定性的影响,金融论坛,经济与管理,北京市,1100,王相宁,中国科学技术大学,合肥市,3401.0, 张志洋,2010-12-01,F
4408,银行信贷中的行业风险测度,金融论坛,经济与管理,北京市,1100,陈红艳,南京工业大学,南京市,3201.0, 王加中,2010-12-01,F
4410,银行债权与盈余管理的公司治理效应,金融论坛,经济与管理,北京市,1100,雷强,上海交通大学,上海市,3100.0, 李争争,2010-09-01,F;F;F;F
4411,商业银行内部评级法的违约概率预测新方法——含随机效应的二值响应面板数据模型,金融论坛,经济与管理,北京市,1100,郑大川,华侨大学,泉州市,3505.0, 沈利生; 黄震,2010-09-01,F;F
4412,中国上市银行中间业务的运作效率与关联效益,金融论坛,经济与管理,北京市,1100,闫晓晨,南开大学,天津市,1200.0,,2010-09-01,F
4413,银行业上市公司盈利能力持续性的影响因素,金融论坛,经济与管理,北京市,1100,郭小群,南昌航空大学,南昌市,3601.0, 杨剑波; 彭本红,2010-09-01,F;F;F
4414,金融生态环境与外资银行在华投资的省域选择,金融论坛,经济与管理,北京市,1100,张满银,北京科技大学,北京市,1100.0, 韩大海,2010-10-01,F;F;F
4415,软集合在商业银行客户价值评价中的应用,金融论坛,经济与管理,北京市,1100,肖智,重庆大学,重庆市,5000.0, 胡蓓,2010-10-01,F;F;F
4418,地区金融环境与中小企业融资行为——基于苏州、无锡中小企业调查问卷的研究,金融论坛,经济与管理,北京市,1100,万芊,北京大学,北京市,1100.0, 刘力,2010-10-01,F;F;F
4419,市场结构、资本监管与银行风险承担,金融论坛,经济与管理,北京市,1100,宋琴,厦门大学,厦门市,3502.0, 郑振龙,2010-11-01,F;F
4420,银行间国债市场流动性黑洞的诱导因素,金融论坛,经济与管理,北京市,1100,马俐丽,南京航空航天大学,南京市,3201.0, 顾金宏,2010-11-01,F;F
4421,中国上市银行特许权价值的自律效应,金融论坛,经济与管理,北京市,1100,孙犇,暨南大学,广州市,4401.0, 黄河,2010-11-01,F
4422,贷款规模与授信企业社会责任的表现,金融论坛,经济与管理,北京市,1100,萧松华,暨南大学,广州市,4401.0, 沈毅,2010-11-01,F
4424,商业银行信贷的国别风险与管理策略,金融论坛,经济与管理,北京市,1100,张惠,南京财经大学,南京市,3201.0, 陆岷峰,2010-12-01,F
4426,商业银行竞争力评价——基于ANP模型的研究,金融论坛,经济与管理,北京市,1100,黄德春,河海大学,南京市,3201.0, 马慧妍; 刘炳胜,2010-12-01,F
4428,声誉风险视角下商业银行服务收费问题分析,金融论坛,经济与管理,北京市,1100,聂桂平,中国银行,北京市,1100.0,,2010-12-01,F
4429,小额贷款公司的经营状态——基于宁波市小额贷款公司的调查,金融论坛,经济与管理,北京市,1100,田剑英,浙江万里学院,宁波市,3302.0, 沈思源,2010-12-01,F
4430,基于非直接损失性的商业银行操作风险度量研究,金融论坛,经济与管理,北京市,1100,潘建国,天津大学,天津市,1200.0, 王惠,2009-01-01,F;F
4433,上市银行治理机制对风险承担的影响(2000～2007),金融论坛,经济与管理,北京市,1100,曹艳华,青岛大学,青岛市,3702.0, 牛筱颖,2009-01-01,F;F
4435,中国区域金融市场竞争差异的实证研究——来自1997～2006年的经验证据,金融论坛,经济与管理,北京市,1100,曹源芳,南京大学,南京市,3201.0,,2009-01-01,F;F
4437,我国商业银行公司治理的特殊性分析,金融论坛,经济与管理,北京市,1100,刘懿,西南财经大学,成都市,5101.0, 罗希,2009-02-01,F
4438,基于价值链的商业银行汽车金融业务战略设计,金融论坛,经济与管理,北京市,1100,牛大勇,哈尔滨工程大学,哈尔滨市,2301.0, 李柏洲,2009-02-01,F
4440,商业银行预算管理技术支持体系研究,金融论坛,经济与管理,北京市,1100,陶能虹,中央财经大学,北京市,1100.0,,2009-02-01,F;F
4443,汇丰私人银行案例研究及启示,金融论坛,经济与管理,北京市,1100,叶菲,中国人民大学,北京市,1100.0, 张红军,2009-03-01,F
4444,中国中小企业信贷风险评估研究,金融论坛,经济与管理,北京市,1100,杨元泽,西安交通大学,西安市,6101.0,,2009-03-01,F
4446,内部评级体系定量验证模型及在中国银行业的应用,金融论坛,经济与管理,北京市,1100,李红侠,招商银行,深圳市,4403.0,,2009-04-01,F;F
4447,《巴塞尔Ⅲ》解析,金融论坛,经济与管理,北京市,1100,王冬,北京大学,北京市,1100.0, 李圆,2010-12-01,F
4449,商业银行操作风险度量模型的比较与分析,金融论坛,经济与管理,北京市,1100,沈怡斐,上海交通大学,上海市,3100.0,,2009-01-01,F
4450,基于贷款交易业务模式创新的信贷资产组合管理研究,金融论坛,经济与管理,北京市,1100,谢刚,中国人民大学,北京市,1100.0, 李勇,2009-01-01,F
4453,中国大型商业银行境外机构的营销策略研究——以中国工商银行(伦敦)有限公司为例,金融论坛,经济与管理,北京市,1100,方斐,浙江大学,杭州市,3301.0, 肖文,2009-02-01,F
4455,解读信贷推动下的美国房地产泡沫与金融危机——基于2000～2008年月度数据的理论分析与实证检验,金融论坛,经济与管理,北京市,1100,李成,西安交通大学,西安市,6101.0, 王建军,2009-02-01,F;F;F
4456,银行业市场约束机制的框架阐释,金融论坛,经济与管理,北京市,1100,孙龙建,南开大学,天津市,1200.0,,2009-02-01,F
4458,中国上市公司违约率的顺周期效应实证研究——评估巴塞尔协议Ⅱ顺周期效应的初步尝试,金融论坛,经济与管理,北京市,1100,鹿波,北京大学,北京市,1100.0,,2009-03-01,F;F
4461,国债收益率曲线构建的国际比较研究——兼论商业银行人民币收益率曲线的构建,金融论坛,经济与管理,北京市,1100,胡新华,北京大学,北京市,1100.0, 徐志宏,2009-03-01,F
4463,中国银行业市场化改革的效率效应——基于宏观投资效率的实证分析,金融论坛,经济与管理,北京市,1100,刘仁和,华南农业大学,广州市,4401.0, 米运生,2009-03-01,F;F
4465,商业银行分客户绩效的灰色评价研究,金融论坛,经济与管理,北京市,1100,徐程兴,北京大学,北京市,1100.0, 胡广文,2009-04-01,F;F
4466,我国金融资产管理公司商业化转型研究,金融论坛,经济与管理,北京市,1100,林冬元,湘潭大学,湘潭市,4303.0,,2009-04-01,F
4468,欧洲银行保险的发展及其对中国的启示,金融论坛,经济与管理,北京市,1100,袁成,南京大学,南京市,3201.0, 裴平,2009-04-01,F;F;F
4470,当前扩大内需应该把握好的几个问题,金融论坛,经济与管理,北京市,1100,田秋生,华南理工大学,广州市,4401.0, 牛江涛,2009-05-01,F
4471,商业银行跨国经营模式的理论分析与实证检验,金融论坛,经济与管理,北京市,1100,李伟杰,中国人民银行,北京市,1100.0, 宋焱,2009-05-01,F;F
4473,资本监管压力下的商业银行风险承担行为——基于不同性质商业银行(2004～2007)的比较研究,金融论坛,经济与管理,北京市,1100,曹艳华,西安交通大学,西安市,6101.0,,2009-05-01,F;F
4475,美国次贷危机对我国房地产信贷风险研究的启示,金融论坛,经济与管理,北京市,1100,张雯,江西财经大学,南昌市,3601.0,,2009-05-01,F
4476,推进人民币资本项目可兑换的相关问题研究,金融论坛,经济与管理,北京市,1100,斯琴图雅,复旦大学,上海市,3100.0,,2009-06-01,F
4477,中国银行业的宏观效率研究,金融论坛,经济与管理,北京市,1100,王平,四川大学,成都市,5101.0, 邹易; 唐柳,2009-06-01,F
4478,中国银行业存款产品设计存在的问题与改进建议,金融论坛,经济与管理,北京市,1100,张桥云,西南财经大学,成都市,5101.0, 陈跃军,2009-06-01,F
4480,关于以小企业贷款产品的价值基础定价的思考,金融论坛,经济与管理,北京市,1100,陆岷峰,南京大学,南京市,3201.0, 周海波,2009-06-01,F
4481,次贷危机中房贷经纪商道德风险治理问题研究——从控制权配置的角度探讨,金融论坛,经济与管理,北京市,1100,武夏,复旦大学,上海市,3100.0, 陈学彬,2009-06-01,F;F
4483,从成本-收益视角看中国银行业监管的路径选择,金融论坛,经济与管理,北京市,1100,刘毅,北京工商大学,北京市,1100.0, 文珊,2009-07-01,F
4484,澳大利亚金融服务督察机制及其对消费者的保护,金融论坛,经济与管理,北京市,1100,邢会强,中央财经大学,北京市,1100.0,,2009-07-01,F
4485,中国上市公司股东投票出席行为研究——基于股权分置改革分类表决的实证分析,金融论坛,经济与管理,北京市,1100,邢天才,东北财经大学,大连市,2102.0, 宗计川,2009-07-01,F
4487,信贷配给理论发展、模型与实证研究,金融论坛,经济与管理,北京市,1100,任建军,湖南大学,长沙市,4301.0,,2009-04-01,F;F
4488,房地产开发企业违约概率压力测试研究——现金流蒙特卡洛模拟方法在银行中的应用,金融论坛,经济与管理,北京市,1100,陈阳,北京大学,北京市,1100.0, 陈双杰,2009-04-01,F
4491,商业银行经济资本“组合效应”与分配方法研究,金融论坛,经济与管理,北京市,1100,陈阳,北京大学,北京市,1100.0, 郑新广,2009-05-01,F
4492,社会责任视角下提升商业银行核心竞争力研究,金融论坛,经济与管理,北京市,1100,刘亦文,湖南大学,长沙市,4301.0,,2009-05-01,F
4493,商业银行行长胜任力测评量表的编制及应用研究,金融论坛,经济与管理,北京市,1100,黄勋敬,中山大学,广州市,4401.0,,2009-05-01,F;F
4494,信用卡消费偏好与营销策略制定——以北京、天津、上海和深圳地区青年白领人群为例,金融论坛,经济与管理,北京市,1100,王大海,南开大学,天津市,1200.0, 韩德昌; 郑玉香,2009-05-01,F;F
4495,经济学思维范式的“失真”与“危机校准”——评《次贷危机正在改变世界》,金融论坛,经济与管理,北京市,1100,李念,复旦大学,上海市,3100.0,,2009-05-01,F
4496,利率市场化改革对商业银行经营的影响及建议——以山西省商业银行为例进行分析,金融论坛,经济与管理,北京市,1100,周梅,山西财经大学,太原市,1401.0, 扈照轼,2009-05-01,F
4498,计量技术在信用风险管理中的应用——兼论我国商业银行引进和运用计量技术中存在的问题及建议,金融论坛,经济与管理,北京市,1100,于晨曦,清华大学,北京市,1100.0,,2009-06-01,F;F
4500,异质提前还款因素下住房抵押贷款定价研究,金融论坛,经济与管理,北京市,1100,王鹰翔,西安交通大学,西安市,6101.0, 李晔,2009-06-01,F;F
4501,金融地理视角下中国信贷供给的区域效应研究,金融论坛,经济与管理,北京市,1100,刘淑芳,西安交通大学,西安市,6101.0, 史瑛; 刘治国,2009-06-01,F
4502,经济调整对中国商业银行经营的影响及对策研究,金融论坛,经济与管理,北京市,1100,张亦春,厦门大学,厦门市,3502.0, 孙君明,2009-07-01,F
4503,国际金融危机背景下中国局部银行危机问题研究,金融论坛,经济与管理,北京市,1100,彭科,招商银行,深圳市,4403.0,,2009-07-01,F
4504,金融类上市公司并购绩效的实证研究,金融论坛,经济与管理,北京市,1100,金永红,华东理工大学,上海市,3100.0, 薛婷婷,2009-07-01,F
4506,全球金融危机对中国金融创新发展的启示,金融论坛,经济与管理,北京市,1100,秦建文,广西大学,南宁市,4501.0, 梁珍,2009-07-01,F;F
4507,中国人民大学财政金融学院,金融论坛,经济与管理,北京市,1100,郭庆旺,中国人民大学,北京市,1100.0,,2009-08-01,G
4509,中小企业融资与中小银行的发展,金融论坛,经济与管理,北京市,1100,张格,北京大学,北京市,1100.0,,2009-09-01,F;F
4510,我国商业银行操作风险的统计特征与防控对策,金融论坛,经济与管理,北京市,1100,曾沫冰,华中科技大学,武汉市,4201.0,,2009-09-01,F
4513,对中国商业银行净利差决定因素的实证分析,金融论坛,经济与管理,北京市,1100,何娜,南开大学,天津市,1200.0, 李泽广,2009-08-01,F;F
4514,中国商业银行社会责任评价指标体系构建探讨,金融论坛,经济与管理,北京市,1100,萧松华,暨南大学,广州市,4401.0, 谭超颖,2009-08-01,F
4517,信贷资金分布与宏观经济波动——基于中国2000～2008年的实证分析,金融论坛,经济与管理,北京市,1100,潘再见,厦门大学,厦门市,3502.0,,2009-08-01,F;F;F
4518,中国区域信贷配给现状及区域差异分析,金融论坛,经济与管理,北京市,1100,任建军,湖南大学,长沙市,4301.0,,2009-10-01,F
4519,人民币利率互换市场现状及商业银行的应对策略,金融论坛,经济与管理,北京市,1100,于金酉,北京大学,北京市,1100.0, 王屯,2009-10-01,F;F
4520,商业银行操作风险衡量与管理方法及其运用,金融论坛,经济与管理,北京市,1100,沈全芳,日照职业技术学院,日照市,3711.0,,2009-11-01,F
4523,商业银行人权政策框架研究,金融论坛,经济与管理,北京市,1100,冯守尊,中信银行,北京市,1100.0,,2009-09-01,D
4524,当前经济衰退的性质与宏观经济政策选择,金融论坛,经济与管理,北京市,1100,葛兆强,招商银行,深圳市,4403.0,,2009-08-01,F
4525,中小企业融资需求结构分析及相应的对策研究,金融论坛,经济与管理,北京市,1100,骆守俭,华东理工大学,上海市,3100.0, 尹邦奇; 傅小婧; 陈正辉; 陈青青,2009-08-01,F
4526,商业银行对中小企业信用风险评价的方法探索,金融论坛,经济与管理,北京市,1100,卢超,兰州大学,兰州市,6201.0, 钟望舒,2009-09-01,F;F
4527,商业银行同业竞争情报工作机制研究,金融论坛,经济与管理,北京市,1100,冯亚萍,西安交通大学,西安市,6101.0,,2009-09-01,F
4528,我国商业银行服务营销文化战略体系的构想,金融论坛,经济与管理,北京市,1100,朱明,西南交通大学,成都市,5101.0, 周伯林,2009-09-01,F;F
4529,我国商业银行履行社会责任问题研究,金融论坛,经济与管理,北京市,1100,张鹏,中央财经大学,北京市,1100.0, 李克川,2009-08-01,F;F
4530,商业银行合规风险研究,金融论坛,经济与管理,北京市,1100,周慧,中国人民大学,北京市,1100.0,,2009-08-01,F
4533,供应链金融市场风险控制套期保值方法研究,金融论坛,经济与管理,北京市,1100,熊熊,天津大学,天津市,1200.0, 马佳; 赵文杰; 符蓉; 王小琰,2009-09-01,F;F;F
4534,我国国有(控股)商业银行道德风险治理研究,金融论坛,经济与管理,北京市,1100,卫功琦,南京农业大学,南京市,3201.0,,2009-10-01,F
4535,碳金融与我国商业银行的业务创新,金融论坛,经济与管理,北京市,1100,陈游,湖州职业技术学院,湖州市,3305.0,,2009-10-01,F;F
4537,试论房价波动对商业银行资产的影响,金融论坛,经济与管理,北京市,1100,李成,西安交通大学,西安市,6101.0, 尚振宁; 黎克俊,2009-10-01,F;F;F
4539,大宗商品价格波动与中国信贷市场运行分析,金融论坛,经济与管理,北京市,1100,苏明,中山大学,广州市,4401.0, 陆军,2009-10-01,F;F
4540,我国商业银行分行传统业绩评价的缺陷及重建,金融论坛,经济与管理,北京市,1100,丁增稳,安徽商贸职业技术学院,芜湖市,3402.0,,2009-11-01,F
4548,商业银行集团授信客户行业分散风险研究,金融论坛,经济与管理,北京市,1100,张晓宏,中国银监会,北京市,1100.0,,2009-12-01,F
4550,中外商业银行核心竞争力的比较,金融论坛,经济与管理,北京市,1100,许南,湖南师范大学,长沙市,4301.0, 曾翠,2008-01-01,F
4554,中国银行资本监管模式选择研究,金融论坛,经济与管理,北京市,1100,王晓龙,西安交通大学,西安市,6101.0, 周好文,2008-01-01,F
4555,声誉机制、信任机制与小额信贷,金融论坛,经济与管理,北京市,1100,赵岩青,中国农业大学,北京市,1100.0, 何广文,2008-01-01,F
4557,关于创建中小企业“1+N”授信模式的研究,金融论坛,经济与管理,北京市,1100,刘长宏,上海浦东发展银行,上海市,3100.0, 王春晖; 吴迪,2008-02-01,F;F
4558,中国信用担保机构的信用风险分析,金融论坛,经济与管理,北京市,1100,袁象,上海海事大学,上海市,3100.0, 余思勤; 卞玥杰,2008-02-01,F
4560,浮动利率房贷提前还款的损失度量,金融论坛,经济与管理,北京市,1100,卜壮志,西安交通大学,西安市,6101.0, 徐成贤,2008-02-01,F;F
4561,机构投资者股权对银行公司治理与绩效的影响,金融论坛,经济与管理,北京市,1100,伍伟,中南财经政法大学,武汉市,4201.0, 刘惠好,2008-07-01,F;F
4562,基于ERM的商业银行操作风险生态内部控制系统研究,金融论坛,经济与管理,北京市,1100,陈晓慧,东南大学,南京市,3201.0, 吴应宇,2008-07-01,F
4563,提高我国商业银行效率的政策性思考,金融论坛,经济与管理,北京市,1100,油晓峰,山西财经大学,太原市,1401.0, 张晓丽,2009-11-01,F
4564,中介机构信用卡套现问题研究,金融论坛,经济与管理,北京市,1100,柯建飞,华侨大学,泉州市,3505.0,,2009-11-01,F
4565,国际资本抽逃对国有控股银行股价稳定性分析,金融论坛,经济与管理,北京市,1100,孙振东,中山大学,广州市,4401.0, 林沛玉,2009-11-01,F
4566,风险竞争、银行效率与监管有效性——“金砖四国”的经验研究与政策建议,金融论坛,经济与管理,北京市,1100,邹朋飞,江西财经大学,南昌市,3601.0, 廖进球,2009-12-01,F;F;F
4567,银行中年员工的职场心理养生探讨,金融论坛,经济与管理,北京市,1100,何茂荣,长春金融研修学院,长春市,2201.0,,2009-12-01,F;F
4568,中国商业银行海外并购经济后果研究——以招商银行并购永隆银行为例,金融论坛,经济与管理,北京市,1100,胡挺,广东工业大学,广州市,4401.0, 刘娥平,2009-12-01,F;F
4569,商业银行保证金账户的法律性质与风险防范措施,金融论坛,经济与管理,北京市,1100,王娇莺,中国政法大学,北京市,1100.0,,2009-12-01,F
4571,EDF模型在中国商业银行信用风险管理中的应用,金融论坛,经济与管理,北京市,1100,李舜蛟,兰州大学,兰州市,6201.0, 王文胜,2008-01-01,F;F
4572,化解流动性过剩的一个现实选择——以优化金融功能为目标进行商业银行战略转型,金融论坛,经济与管理,北京市,1100,邓黎阳,北京大学,北京市,1100.0, 王勇,2008-01-01,F
4575,中国金融机构信贷总量增长:文献综述与实证分析,金融论坛,经济与管理,北京市,1100,童士清,上海财经大学,上海市,3100.0,,2008-01-01,F
4578,改善中小企业融资监管环境策略探析,金融论坛,经济与管理,北京市,1100,孙俊波,中国银行,北京市,1100.0, 杜信立,2008-02-01,F;F
4579,商业银行服务质量的度量及其对客户忠诚度的影响,金融论坛,经济与管理,北京市,1100,陈莹,南京大学,南京市,3201.0, 武志伟,2008-02-01,F
4580,银行业前瞻性贷款损失准备金计提方法的研究,金融论坛,经济与管理,北京市,1100,李宇嘉,中山大学,广州市,4401.0, 陆军,2008-02-01,F
4581,区域经济发展与商业银行战略选择——辽宁省商业银行应力争在东北振兴中实现双赢,金融论坛,经济与管理,北京市,1100,刘治国,中国社会科学院,北京市,1100.0,,2008-07-01,F
4582,论商业银行的社会责任,金融论坛,经济与管理,北京市,1100,曹涌涛,重庆大学,重庆市,5000.0, 王建萍,2008-07-01,F
4583,我国商业银行经营绩效的比较与驱动因素分析,金融论坛,经济与管理,北京市,1100,陈莹,南京大学,南京市,3201.0,,2008-10-01,F;F
4584,中国银行业结构变迁与经济增长的实证研究,金融论坛,经济与管理,北京市,1100,陈刚,西南政法大学,重庆市,5000.0, 冯艳; 杨亮,2008-10-01,F;F;F
4585,试论关系借贷促进中小企业融资的机理——基于非标准化信息模型的分析,金融论坛,经济与管理,北京市,1100,邢英,济南大学,济南市,3701.0, 张伟; 乐菲菲,2008-10-01,F;F
4587,中国上市银行独立董事制度创新研究,金融论坛,经济与管理,北京市,1100,孙君阳,山东大学,济南市,3701.0, 殷世波,2008-09-01,F
4590,房地产贷款中的信息不充分及其风险,金融论坛,经济与管理,北京市,1100,陆克今,南京理工大学,南京市,3201.0, 郁洪良,2008-09-01,F;F
4591,结构性衍生产品的定价和风险管理技术,金融论坛,经济与管理,北京市,1100,胡新华,北京大学,北京市,1100.0,,2008-09-01,F
4592,我国上市银行高管薪酬和经营绩效相关性研究,金融论坛,经济与管理,北京市,1100,杨大光,东北师范大学,长春市,2201.0, 朱贵云; 武治国,2008-08-01,F;F
4594,美国银行业账户管理费实证研究,金融论坛,经济与管理,北京市,1100,张桥云,西南财经大学,成都市,5101.0,,2008-08-01,F
4595,商业银行金融衍生品交易与风险管理——以法国兴业银行等为例,金融论坛,经济与管理,北京市,1100,王应贵,南京财经大学,南京市,3201.0,,2008-08-01,F
4598,商业银行分客户的盈利评价模型研究,金融论坛,经济与管理,北京市,1100,徐程兴,北京大学,北京市,1100.0, 谷澍,2008-06-01,F
4599,国内商业银行预算管理研究现状及启示,金融论坛,经济与管理,北京市,1100,陶能虹,中央财经大学,北京市,1100.0,,2008-10-01,F
4601,基于法律视角下商业银行贷款核准制的风险分析与控制,金融论坛,经济与管理,北京市,1100,任建军,湖南大学,长沙市,4301.0, 段维明; 杨名杰,2008-10-01,D;F
4604,国有商业银行信任与忠诚文化基因研究——基于高素质人才“退出—呼吁”机制的分析,金融论坛,经济与管理,北京市,1100,崔宏,中国民生银行,北京市,1100.0,,2008-09-01,F
4606,上海银行间同业拆放利率报价准确性分析,金融论坛,经济与管理,北京市,1100,田敏,西安交通大学,西安市,6101.0, 邱长溶; 马雷,2008-09-01,F;F
4607,当前上市银行投资者关系管理热点问题研究,金融论坛,经济与管理,北京市,1100,王昌盛,北京交通大学,北京市,1100.0, 孔祥纬,2008-09-01,F
4612,商业银行中间业务的隐性需求与创新,金融论坛,经济与管理,北京市,1100,陈向阳,广州大学,广州市,4401.0, 邓小惠,2008-08-01,F
