,title,mag_name,mag_classn,mag_city,mag_city_code,author_first,author_unit_first,unit_city,unit_city_code,coauthor,ym,class_num
0,中国式分权与新发展理念语境中的标尺竞争,管理世界,经济与管理,北京市,1100,刘珊珊,上海财经大学,上海市,3100.0, 马志远,2017-12-01,D
1,海洋生态补偿的制度建设与治理实践——基于国际比较视角,管理世界,经济与管理,北京市,1100,朱炜,山东财经大学,济南市,3701.0, 王乐锦; 王斌; 谈立群,2017-12-01,D
2,新常态下中国流动人口的居留意愿与家庭消费水平研究,管理世界,经济与管理,北京市,1100,李国正,北京工业大学,北京市,1100.0, 艾小青; 邬嘉迪,2017-12-01,C;F
3,提高最低工资会拉升产品价格吗?,管理世界,经济与管理,北京市,1100,徐建炜,北京师范大学,北京市,1100.0, 邹静娴; 毛捷,2017-12-01,F;F
4,多个大股东与企业融资约束——基于文本分析的经验证据,管理世界,经济与管理,北京市,1100,姜付秀,中国人民大学,北京市,1100.0, 王运通; 田园; 吴恺,2017-12-01,F
5,寻找创新驱动发展的新理论思维——基于新熊彼特增长理论的思考,管理世界,经济与管理,北京市,1100,柳卸林,中国科学院,北京市,1100.0, 高雨辰; 丁雪辰,2017-12-01,F
6,思维定势如何影响创意质量——基于“众包”平台的实证研究,管理世界,经济与管理,北京市,1100,杨光,上海财经大学,上海市,3100.0, 汪立,2017-12-01,F
7,内部员工优势——来自企业人事数据的实证证据,管理世界,经济与管理,北京市,1100,张红,暨南大学,广州市,4401.0, 周黎安; 梁建章,2017-12-01,F
8,领导宽恕与员工抑制性建言的关系研究,管理世界,经济与管理,北京市,1100,张亚军,贵州财经大学,贵阳市,5201.0, 张磊,2017-12-01,F
9,数字技术革命背景下零售业商业模式创新研究,管理世界,经济与管理,北京市,1100,齐严,北京物资学院,北京市,1100.0, 司亚静; 吴利红,2017-12-01,F
10,环保督察与地方政府履责行为的博弈分析,管理世界,经济与管理,北京市,1100,卢瑶,华中科技大学,武汉市,4201.0,,2017-11-01,D;X
11,邻里关系对农村留守老人身心健康的影响研究——基于劳动力流出地10省市调查数据的实证分析,管理世界,经济与管理,北京市,1100,张邦辉,重庆大学,重庆市,5000.0, 陈乙酉,2017-11-01,C;C
12,关注房价还是关注股价——基于货币政策对资产价格反应的模拟分析,管理世界,经济与管理,北京市,1100,姚云霞,安徽财贸职业学院,合肥市,3401.0, 章贵桥,2017-11-01,F;F;F
13,经济发展中的技术创新、技术溢出与行业收入差距演变——对U型假说的理论解释与实证检验,管理世界,经济与管理,北京市,1100,周云波,南开大学,天津市,1200.0, 田柳; 陈岑,2017-11-01,F
14,土地承包经营权流转、劳动力流动与农业生产,管理世界,经济与管理,北京市,1100,陈媛媛,上海财经大学,上海市,3100.0, 傅伟,2017-11-01,F;F
15,中国女企业家发展:现状、问题与期望——2505位女企业家问卷调查报告,管理世界,经济与管理,北京市,1100,李兰,中国女企业家协会,北京市,1100.0, 仲为国; 王云峰,2017-11-01,F
16,“营改增”、企业利润率与企业创新,管理世界,经济与管理,北京市,1100,孙吉乐,兰州大学,兰州市,6201.0,,2017-11-01,F;F;F
17,社会责任信息披露的“掩饰效应”和上市公司崩盘风险——来自中国股票市场的DID-PSM分析,管理世界,经济与管理,北京市,1100,田利辉,南开大学,天津市,1200.0, 王可第,2017-11-01,F
18,家庭金融学的构建与进展,管理世界,经济与管理,北京市,1100,陶春生,中央民族大学,北京市,1100.0,,2017-11-01,F
19,创新集群知识网络环境系统构成及实证分析,管理世界,经济与管理,北京市,1100,郑成华,西安建筑科技大学,西安市,6101.0, 罗福周; 韩言虎,2017-11-01,C
20,中国对外贸易增长与隐含碳排放脱钩关系研究,管理世界,经济与管理,北京市,1100,胡剑波,贵州财经大学,贵阳市,5201.0, 高鹏; 张伟,2017-10-01,F;X
21,政治激励、资本监管与地方银行信贷投放,管理世界,经济与管理,北京市,1100,刘冲,上海财经大学,上海市,3100.0, 郭峰; 傅家范; 周强龙,2017-10-01,D;F
22,地方政府绩效考核主体群的界定及分工探析,管理世界,经济与管理,北京市,1100,戴胜利,华中师范大学,武汉市,4201.0, 张伟,2017-10-01,D
23,自媒体时代公共管理的挑战与机遇——政府信任的视角,管理世界,经济与管理,北京市,1100,丁香桃,华东师范大学,上海市,3100.0,,2017-12-01,D
24,京津冀流动人口调控联动机制分析,管理世界,经济与管理,北京市,1100,冯虹,北京工业大学,北京市,1100.0, 刘婷婷,2017-12-01,C;F
25,个人所得税减免会增加劳动供给吗?——来自准自然实验的证据,管理世界,经济与管理,北京市,1100,叶菁菁,西南财经大学,成都市,5101.0, 吴燕; 陈方豪; 王宇晴,2017-12-01,F;F
26,中国家庭金融投资组合的风险——过于保守还是过于冒进?,管理世界,经济与管理,北京市,1100,路晓蒙,西南财经大学,成都市,5101.0, 李阳; 甘犁; 王香,2017-12-01,F;F
27,"坚持新发展理念,推动现代化经济体系建设——学习习近平新时代中国特色社会主义思想关于新发展理念的体会",管理世界,经济与管理,北京市,1100,刘伟,中国人民大学,北京市,1100.0,,2017-12-01,F
28,企业家对宏观形势及企业经营状况的判断、问题和建议——2017·中国企业经营者问卷跟踪调查报告,管理世界,经济与管理,北京市,1100,李兰,中国企业家调查系统,北京市,1100.0, 潘建成; 彭泗清; 王云峰,2017-12-01,F
29,社会信任是否会提升企业并购绩效?,管理世界,经济与管理,北京市,1100,王艳,广东财经大学,广州市,4401.0, 李善民,2017-12-01,F
30,如何通过政府营销推动地方创业活动——基于武汉市政府创业营销的案例研究,管理世界,经济与管理,北京市,1100,汪涛,武汉大学,武汉市,4201.0, 肖潇; 聂春艳,2017-12-01,F
31,中国式“压力型”财政激励的财源增长效应——基于取消农业税改革的实证研究,管理世界,经济与管理,北京市,1100,谢贞发,厦门大学,厦门市,3502.0, 严瑾; 李培,2017-12-01,F
32,经济学研究中“数学滥用”现象及反思,管理世界,经济与管理,北京市,1100,陆蓉,上海财经大学,上海市,3100.0, 邓鸣茂,2017-11-01,F;O
33,基于Sen可行能力理论的农民工福利制度改进研究,管理世界,经济与管理,北京市,1100,宋艳,哈尔滨工程大学,哈尔滨市,2301.0, 苏子逢; 门建营; 孙典,2017-11-01,D
34,中国劳动力市场所有制分割的根源与表现,管理世界,经济与管理,北京市,1100,马草原,西安交通大学,西安市,6101.0, 马文涛; 李成,2017-11-01,F
35,习近平经济思想与中国特色社会主义政治经济学构建,管理世界,经济与管理,北京市,1100,王东京,中央党校,北京市,1100.0,,2017-11-01,F;F
36,农业机械化的空间溢出效应及其分布规律——农机跨区服务的视角,管理世界,经济与管理,北京市,1100,方师乐,浙江大学,杭州市,3301.0, 卫龙宝; 伍骏骞,2017-11-01,F
37,生产制造还是资本投资?中国工业企业国际创业资本的流向——基于制度距离的解释,管理世界,经济与管理,北京市,1100,葛菲,上海师范大学,上海市,3100.0, 贺小刚,2017-11-01,F
38,从自利到德行:商业组织的制度逻辑变革研究,管理世界,经济与管理,北京市,1100,刘德鹏,山东大学,济南市,3701.0, 贾良定; 刘畅唱; 蔡亚华; 郑雅琴,2017-11-01,F
39,分析师荐股更新利用管理层语调吗?——基于业绩说明会的文本分析,管理世界,经济与管理,北京市,1100,林乐,首都经济贸易大学,北京市,1100.0, 谢德仁,2017-11-01,F
40,中国本土管理研究路径探索——基于实践理论的视角,管理世界,经济与管理,北京市,1100,陈春花,北京大学,北京市,1100.0, 马胜辉,2017-11-01,C
41,基于DEA交叉效率模型的钢铁行业能源效率分析,管理世界,经济与管理,北京市,1100,刘学之,北京化工大学,北京市,1100.0, 黄敬; 王玉,2017-10-01,F;F
42,居民阶梯电价政策的技术创新诱导效应研究,管理世界,经济与管理,北京市,1100,罗传建,华中科技大学,武汉市,4201.0, 刘章生,2017-10-01,F
43,规范与表达:公共服务需求的分析框架及其政策意涵,管理世界,经济与管理,北京市,1100,容志,上海师范大学,上海市,3100.0,,2017-10-01,D
44,大学的本质及其合约安排:一个现代企业理论的范式,管理世界,经济与管理,北京市,1100,郑文全,东北财经大学,大连市,2102.0,,2017-10-01,G
45,制度逃离还是创新驱动?——制度约束与民营企业的对外直接投资,管理世界,经济与管理,北京市,1100,李新春,中山大学,广州市,4401.0, 肖宵,2017-10-01,F;F
46,企业避税、债务融资与债务融资来源——基于所得税征管体制改革的断点回归分析,管理世界,经济与管理,北京市,1100,刘行,东北财经大学,大连市,2102.0, 赵健宇; 叶康涛,2017-10-01,F;F
47,海外子公司角色分类及其与管控方式的匹配效应——一项双层多案例定性比较分析,管理世界,经济与管理,北京市,1100,郝瑾,西藏民族大学,咸阳市,6104.0, 王凤彬; 王璁,2017-10-01,F
48,控股股东股权质押与审计师风险应对,管理世界,经济与管理,北京市,1100,翟胜宝,安徽财经大学,蚌埠市,3403.0, 许浩然; 刘耀淞; 唐玮,2017-10-01,F;F
49,新三板的发展瓶颈与对策研究,管理世界,经济与管理,北京市,1100,齐杏发,华东师范大学,上海市,3100.0,,2017-10-01,F
50,我国海上运输通道公共安全保障能力:结构与优化,管理世界,经济与管理,北京市,1100,马晓雪,大连海事大学,大连市,2102.0, 贾世娜; 韩依潼,2017-09-01,D;F
51,大数据与城市应急管理:态势、挑战与展望,管理世界,经济与管理,北京市,1100,吴志敏,温州大学,温州市,3303.0,,2017-09-01,D;F;F
52,婚姻匹配、代际流动与家庭模式的个税改革,管理世界,经济与管理,北京市,1100,刘怡,北京大学,北京市,1100.0, 李智慧; 耿志祥,2017-09-01,C;F
53,季度数据比较和混合动力模型测试,管理世界,经济与管理,北京市,1100,祝梓翔,西南交通大学,成都市,5101.0, 邓翔,2017-09-01,F;F
54,如何发挥区域产业集群和专业市场的作用——以义乌产业集群与专业市场联动升级为例,管理世界,经济与管理,北京市,1100,衣保中,吉林大学,长春市,2201.0, 王志辉; 李敏,2017-09-01,F;F
55,企业内部控制质量对上市公司经营绩效影响研究——基于制造业上市公司的实证研究,管理世界,经济与管理,北京市,1100,白默,天津商业大学,天津市,1200.0, 李海英,2017-09-01,F
56,中小股东投票权、公司决策与公司治理——来自一项自然试验的证据,管理世界,经济与管理,北京市,1100,孔东民,中南财经政法大学,武汉市,4201.0, 刘莎莎,2017-09-01,F;F
57,家族成员在董事会中的角色研究——基于家族非执行董事的视角,管理世界,经济与管理,北京市,1100,赵宜一,对外经济贸易大学,北京市,1100.0, 吕长江,2017-09-01,F
58,企业社会责任的多元属性及其实现机制的构建,管理世界,经济与管理,北京市,1100,张世君,首都经济贸易大学,北京市,1100.0,,2017-09-01,F
59,价格刚性、异质性预期和通货膨胀动态,管理世界,经济与管理,北京市,1100,邓燕飞,华东师范大学,上海市,3100.0, 董丰; 徐迎风; 冯文伟,2017-09-01,F;F
60,高管之“人”的先天特征在IPO市场中起作用吗?,管理世界,经济与管理,北京市,1100,沈艺峰,厦门大学,厦门市,3502.0, 王夫乐; 黄娟娟; 纪荣嵘,2017-09-01,F
61,能源安全视角下我国页岩气产业绿色发展路径与保障政策,管理世界,经济与管理,北京市,1100,黎江峰,中国地质大学,北京市,1100.0, 吴巧生; 汪金伟,2017-08-01,F
62,进口农产品贸易对我国耕地规模传导效应实证研究,管理世界,经济与管理,北京市,1100,安芝,上海理工大学,上海市,3100.0, 宋良荣,2017-08-01,F;F;F
63,政府支持型自组织构建——基于深圳食品安全社会共治的案例研究,管理世界,经济与管理,北京市,1100,谢康,中山大学,广州市,4401.0, 刘意; 肖静华; 刘亚平,2017-08-01,D;F
64,美国医疗保障制度公平性与效率性的关系演变分析,管理世界,经济与管理,北京市,1100,周博闻,吉林大学,长春市,2201.0, 崔健,2017-08-01,D;DD
65,城市规模、技能差异与劳动者工资收入,管理世界,经济与管理,北京市,1100,李红阳,南开大学,天津市,1200.0, 邵敏,2017-08-01,F;F
66,基于VAR模型的物流产业与区域经济长期关系研究,管理世界,经济与管理,北京市,1100,张竟成,北京交通大学,北京市,1100.0, 张竟轶,2017-08-01,F;F
67,实现第二个“一百年”目标需要多高增速?,管理世界,经济与管理,北京市,1100,盛来运,国家统计局,北京市,1100.0, 郑鑫,2017-10-01,F
68,国有企业混合所有制改革:动力、阻力与实现路径,管理世界,经济与管理,北京市,1100,綦好东,山东财经大学,济南市,3701.0, 郭骏超; 朱炜,2017-10-01,F
69,政府质量、公司治理结构与投资决策——基于世界银行企业调查数据的经验研究,管理世界,经济与管理,北京市,1100,焦豪,北京师范大学,北京市,1100.0, 焦捷; 刘瑞明,2017-10-01,F;F
70,创业企业如何构建联结组合提升绩效?——基于“结构—资源”互动过程的案例研究,管理世界,经济与管理,北京市,1100,韩炜,西南政法大学,重庆市,5000.0, 杨俊; 陈逢文; 张玉利; 邓渝,2017-10-01,F
71,发挥好财务信息在破解僵尸企业难题中的作用,管理世界,经济与管理,北京市,1100,沈剑飞,华北电力大学,北京市,1100.0,,2017-10-01,F
72,我国宏观审慎政策规则确立与传导路径研究——基于内生银行破产机制的BGG-DSGE模型,管理世界,经济与管理,北京市,1100,李天宇,吉林大学,长春市,2201.0, 张屹山; 张鹤,2017-10-01,F
73,基于RBRVS基础上的医院综合绩效评价,管理世界,经济与管理,北京市,1100,赵进进,郑州大学,郑州市,4101.0,,2017-09-01,R
74,劳动力流动与农村社会治安:模型与实证,管理世界,经济与管理,北京市,1100,刘彬彬,上海交通大学,上海市,3100.0, 林滨; 冯博; 史清华,2017-09-01,D;F
75,基于随机森林的企业监管方法研究,管理世界,经济与管理,北京市,1100,于焕杰,中国人民大学,北京市,1100.0, 杜子芳,2017-09-01,F
76,凝结了中国智慧的马克思主义政治经济学——党的十八大以来我国的经济理论创新,管理世界,经济与管理,北京市,1100,黄晓勇,中国社会科学院,北京市,1100.0,,2017-09-01,F
78,如虎添翼抑或燕巢危幕:承销商、大客户与公司债发行定价,管理世界,经济与管理,北京市,1100,王雄元,中南财经政法大学,武汉市,4201.0, 高开娟,2017-09-01,F;F
79,环境因素、CEO过度自信与IT投资绩效,管理世界,经济与管理,北京市,1100,王铁男,哈尔滨工业大学,哈尔滨市,2301.0, 王宇; 赵凤,2017-09-01,F;F
80,创业生态系统研究的知识基础与前沿重点,管理世界,经济与管理,北京市,1100,滕堂伟,华东师范大学,上海市,3100.0,,2017-09-01,F
81,面子文化中消费者生态产品偏好的眼动研究,管理世界,经济与管理,北京市,1100,施卓敏,中山大学,广州市,4401.0, 郑婉怡,2017-09-01,F
82,声誉提升抑或利益结盟:关联证券分析师实地调研动因研究,管理世界,经济与管理,北京市,1100,唐松莲,华东理工大学,上海市,3100.0, 陈伟,2017-09-01,F
83,空气污染对企业库存的影响——基于我国制造业企业数据的实证研究,管理世界,经济与管理,北京市,1100,李超,西南财经大学,成都市,5101.0, 李涵,2017-08-01,F;F;X
84,网络突发事件的传播与控制策略研究,管理世界,经济与管理,北京市,1100,唐晓彬,对外经济贸易大学,北京市,1100.0, 魏超然; 周志敏; 董莉; 刘敦虎,2017-08-01,D
85,政府的合约性质及其经济治理——基于中国地方政府若干实践的交易费用考察,管理世界,经济与管理,北京市,1100,周燕,中山大学,广州市,4401.0,,2017-08-01,D;F
86,新常态下地方投融资平台转型发展及对策建议,管理世界,经济与管理,北京市,1100,徐鹏程,国务院,北京市,1100.0,,2017-08-01,D
87,大学扩招如何影响高等教育溢价?,管理世界,经济与管理,北京市,1100,马光荣,中国人民大学,北京市,1100.0, 纪洋; 徐建炜,2017-08-01,G
88,论区域政府竞争,管理世界,经济与管理,北京市,1100,陈云贤,广东省人民政府,广州市,4401.0,,2017-08-01,F
89,供需失衡与供给侧结构性改革,管理世界,经济与管理,北京市,1100,余斌,国务院,北京市,1100.0, 吴振宇,2017-08-01,F
90,出行共享中的用户价值共创机理——基于优步的案例研究,管理世界,经济与管理,北京市,1100,杨学成,北京邮电大学,北京市,1100.0, 涂科,2017-08-01,F;F
91,央企董事会试点、国有上市公司代理成本与企业绩效,管理世界,经济与管理,北京市,1100,李文贵,浙江财经大学,杭州市,3301.0, 余明桂; 钟慧洁,2017-08-01,F;F;F
92,分享经济的微观机理研究:新兴古典与新古典,管理世界,经济与管理,北京市,1100,向国成,湖南科技大学,湘潭市,4303.0, 钟世虎; 谌亭颖; 邓明君,2017-08-01,F
93,内部知识转化视角下商业银行服务创新研究,管理世界,经济与管理,北京市,1100,陈晓芳,武汉理工大学,武汉市,4201.0, 黄文才; 夏文蕾; 胡瑜,2017-08-01,F
94,文化认同、国货意识与中国城市市场细分战略——来自中国六城市的证据,管理世界,经济与管理,北京市,1100,何佳讯,华东师范大学,上海市,3100.0, 吴漪; 丁利剑; 王承璐,2017-07-01,F;F;G
95,父母健康:金钱和时间孰轻孰重?——农村子女外出务工影响的再审视,管理世界,经济与管理,北京市,1100,刘畅,南京农业大学,南京市,3201.0, 易福金; 徐志刚,2017-07-01,C
96,中国企业对“一带一路”国家国际化经营方式研究——基于国家距离视角的考察,管理世界,经济与管理,北京市,1100,方慧,山东财经大学,济南市,3701.0, 赵甜,2017-07-01,F;F
97,从地块层面看农业规模经营——基于流转租金与地块规模关系的讨论,管理世界,经济与管理,北京市,1100,纪月清,南京农业大学,南京市,3201.0, 顾天竹; 陈奕山; 徐志刚; 钟甫宁,2017-07-01,F
98,人力资本社会网络与企业创新——基于在线简历数据的实证研究,管理世界,经济与管理,北京市,1100,刘善仕,华南理工大学,广州市,4401.0, 孙博; 葛淳棉; 王琪,2017-07-01,F;F
99,分布式协同创新网络中任务冲突机理研究,管理世界,经济与管理,北京市,1100,刘颖,哈尔滨工业大学,哈尔滨市,2301.0, 胡珑瑛; 王钢,2017-07-01,F
101,股价波动、市场操纵与证券市场监管,管理世界,经济与管理,北京市,1100,钟廷勇,重庆工商大学,重庆市,5000.0, 李江娜; 郭志刚,2017-07-01,F
102,经济政策审计评价作用机制研究,管理世界,经济与管理,北京市,1100,王延军,中国财政科学研究院,北京市,1100.0, 张筱,2017-07-01,F
103,西部地区绿色发展水平测度及空间分异研究,管理世界,经济与管理,北京市,1100,蔡绍洪,贵州财经大学,贵阳市,5201.0, 魏媛; 刘明显,2017-06-01,F;X
104,绿色治理:一种新的分析框架,管理世界,经济与管理,北京市,1100,廖小东,贵州财经大学,贵阳市,5201.0, 史军,2017-06-01,D
105,供给侧改革视阈中的新生代农民工就业转型研究,管理世界,经济与管理,北京市,1100,张宏如,常州大学,常州市,3204.0, 李群; 彭伟,2017-06-01,F;F
106,政府效率、社会决策机制和再分配偏好——基于中国被试的实验经济学研究,管理世界,经济与管理,北京市,1100,杨晓兰,上海外国语大学,上海市,3100.0, 周业安,2017-06-01,F
107,低碳发展作为宏观经济目标的理论探讨——基于中国情形,管理世界,经济与管理,北京市,1100,厉以宁,北京大学,北京市,1100.0, 朱善利; 罗来军; 杨德平,2017-06-01,F
108,品牌生态圈成长路径及其机理研究——云南白药1999～2015年纵向案例研究,管理世界,经济与管理,北京市,1100,许晖,南开大学,天津市,1200.0, 邓伟升; 冯永春; 雷晓凌,2017-06-01,F;F
109,后发国家的适宜性技术进步路径——基于近代中国丝织业发展史的分析,管理世界,经济与管理,北京市,1100,邢楠,吉林财经大学,长春市,2201.0, 袁礼; 国胜铁,2017-06-01,F
110,管理层能力对企业并购的影响研究,管理世界,经济与管理,北京市,1100,肖明,北京科技大学,北京市,1100.0, 李海涛,2017-06-01,F;F
111,服务还是监控:风险投资机构对创业企业的管理——行业专长与不确定性的视角,管理世界,经济与管理,北京市,1100,董静,上海财经大学,上海市,3100.0, 汪江平; 翟海燕; 汪立,2017-06-01,F;F
112,产能过剩引致对外直接投资吗?——2005～2007年中国的经验研究,管理世界,经济与管理,北京市,1100,王自锋,南开大学,天津市,1200.0, 白玥明,2017-08-01,F
113,“原罪”嫌疑与民营企业会计信息质量,管理世界,经济与管理,北京市,1100,唐松,上海财经大学,上海市,3100.0, 温德尔; 孙铮,2017-08-01,F;F
114,从“反应”到“前摄”:万向在美国的合法性战略演化(1994～2015),管理世界,经济与管理,北京市,1100,魏江,浙江大学,杭州市,3301.0, 王诗翔,2017-08-01,F
115,多产品企业、汇率变动与出口价格传递,管理世界,经济与管理,北京市,1100,韩剑,南京大学,南京市,3201.0, 郑秋玲; 邵军,2017-08-01,F;F
116,公务员诚信管理——基于过程的视角,管理世界,经济与管理,北京市,1100,杨秋菊,上海立信会计金融学院,上海市,3100.0,,2017-07-01,D
117,媒体报道能否弥合资本市场上的信息鸿沟?——基于社会关系网络视角的实证考察,管理世界,经济与管理,北京市,1100,杨玉龙,浙江工商大学,杭州市,3301.0, 孙淑伟; 孔祥,2017-07-01,F;G
118,关系制约产业转移吗?——“关系嵌入—信任—转移意愿”的影响研究,管理世界,经济与管理,北京市,1100,杨玲丽,上海政法学院,上海市,3100.0, 万陆,2017-07-01,F
119,“互联网+”背景下的新型农业经营主体信息化发展状况及对策建议——基于全国1394个新型农业经营主体调查数据,管理世界,经济与管理,北京市,1100,阮荣平,中国人民大学,北京市,1100.0, 周佩; 郑风田,2017-07-01,F
120,“振兴东北老工业基地”有利于产值还是利润?——来自中国工业企业数据的证据,管理世界,经济与管理,北京市,1100,董香书,首都经济贸易大学,北京市,1100.0, 肖翔,2017-07-01,F
121,企业捐赠中的锚定效应研究——基于“汶川地震”和“雅安地震”中企业捐赠的实证研究,管理世界,经济与管理,北京市,1100,祝继高,对外经济贸易大学,北京市,1100.0, 辛宇; 仇文妍,2017-07-01,F;F
122,服务型企业顾客融入驱动机制研究——基于体验的视角,管理世界,经济与管理,北京市,1100,陈静,中山大学,广州市,4401.0, 于洪彦; 刘容,2017-07-01,F
123,卖空压力与公司并购——来自卖空管制放松的准自然实验证据,管理世界,经济与管理,北京市,1100,陈胜蓝,内蒙古大学,呼和浩特市,1501.0, 马慧,2017-07-01,F
124,保险代理公司业务转型趋势——以湖北省代理公司业务转型为例,管理世界,经济与管理,北京市,1100,胡亚兰,中南民族大学,武汉市,4201.0,,2017-07-01,F
125,中国管理学研究:大历史跨越中的逻辑困局——相关文献的一个整合性评论,管理世界,经济与管理,北京市,1100,李宝元,北京师范大学,北京市,1100.0, 董青; 仇勇,2017-07-01,C
126,文化创意产业与乡村旅游产业的融合发展研究,管理世界,经济与管理,北京市,1100,李静,山西财经大学,太原市,1401.0,,2017-06-01,F;F;G
127,激励众包网络化创新的知识产权制度研究,管理世界,经济与管理,北京市,1100,叶伟巍,浙江财经大学,杭州市,3301.0,,2017-06-01,D
128,城镇居民住房资产对家庭消费的财富效应,管理世界,经济与管理,北京市,1100,余新平,宁波大学,宁波市,3302.0, 熊德平,2017-06-01,F;F
129,收入不平等、公平偏好与再分配的实验研究,管理世界,经济与管理,北京市,1100,汪良军,浙江工业大学,杭州市,3301.0, 童波,2017-06-01,F
130,金融体制改革与经济效率提升——来自省级面板数据的经验分析,管理世界,经济与管理,北京市,1100,刘贯春,复旦大学,上海市,3100.0, 张军; 丰超,2017-06-01,F;F
131,交通基础设施视角下西部地区制造业集聚的区位熵分析,管理世界,经济与管理,北京市,1100,唐红祥,广西财经学院,南宁市,4501.0,,2017-06-01,F
132,企业规模、政企关系与实际税率——来自世界银行“投资环境调查”的证据,管理世界,经济与管理,北京市,1100,申广军,中央财经大学,北京市,1100.0, 邹静娴,2017-06-01,F;F
133,中国企业创新动向指数:创新的环境、战略与未来——2017·中国企业家成长与发展专题调查报告,管理世界,经济与管理,北京市,1100,仲为国,中国企业家调查系统,北京市,1100.0, 李兰; 路江涌; 彭泗清; 潘建成; 郝大海; 王云峰,2017-06-01,F
