,title,mag_name,mag_classn,mag_city,mag_city_code,author_first,author_unit_first,unit_city,unit_city_code,coauthor,ym,class_num
7021,中国国有企业民营化前后的绩效对比分析,南开经济研究,经济与管理,天津市,1200,李远勤,上海大学,上海市,3100.0, 张祥建,2008-08-01,F
7022,工业经济中外商直接投资与国内投资关系的实证研究,南开经济研究,经济与管理,天津市,1200,张彤玉,南开大学,天津市,1200.0, 牛文俊,2008-08-01,F;F;F
7023,基于TAR模型的中国股市价格泡沫检验,南开经济研究,经济与管理,天津市,1200,孟庆斌,南开大学,天津市,1200.0, 周爱民; 靳晓婷,2008-08-01,F;F
7024,中国公司债券市场与宏观经济关系实证分析,南开经济研究,经济与管理,天津市,1200,邝梅,清华大学,北京市,1100.0, 赵柯,2008-08-01,F;F;F
7025,不完美公共监督重复博弈理论——一个基于方法论的文献综述,南开经济研究,经济与管理,天津市,1200,杜创,北京大学,北京市,1100.0,,2008-06-01,F
7026,收入流动性测度研究述评,南开经济研究,经济与管理,天津市,1200,王朝明,西南财经大学,成都市,5101.0, 胡棋智,2008-06-01,F;F
7027,无配额时代中国纺织品出口竞争优势研究——基于市场结构和竞争力的实证分析,南开经济研究,经济与管理,天津市,1200,刘重力,南开大学,天津市,1200.0, 李慰; 陈静,2009-04-01,F;F
7028,二元劳工市场、解雇保护与劳动合同法,南开经济研究,经济与管理,天津市,1200,唐跃军,复旦大学,上海市,3100.0, 赵武阳,2009-02-01,D
7029,要素投入变化与经济增长的环境效应——基于中国省级面板数据的动态效应分析,南开经济研究,经济与管理,天津市,1200,孙成浩,南京大学,南京市,3201.0, 耿强,2009-02-01,X;F
7030,产业发展战略与空间收敛:长三角、珠三角和环渤海区域增长的比较研究,南开经济研究,经济与管理,天津市,1200,孙洋,清华大学,北京市,1100.0,,2009-02-01,F;F
7031,燃油附加费政策的经济学分析,南开经济研究,经济与管理,天津市,1200,龚强,北京大学,北京市,1100.0,,2009-02-01,F;F;F
7032,国家经济调节方式的转变与新取向的选择——纪念改革开放30年,南开经济研究,经济与管理,天津市,1200,昌忠泽,中央财经大学,北京市,1100.0,,2008-12-01,F
7033,企业规模决定因素的经验考察——来自中国企业面板的证据,南开经济研究,经济与管理,天津市,1200,方明月,中国人民大学,北京市,1100.0, 聂辉华,2008-12-01,F;F
7034,董事会只是为了监督吗?,南开经济研究,经济与管理,天津市,1200,杨其静,中国人民大学,北京市,1100.0, 杨继东,2008-12-01,F
7035,地方政府干预、区域金融发展与中国经济增长方式转型——基于财政分权背景的实证研究,南开经济研究,经济与管理,天津市,1200,张璟,西南财经大学,成都市,5101.0, 沈坤荣,2008-12-01,F;F
7036,为什么如此少的创业企业获得风险投资?,南开经济研究,经济与管理,天津市,1200,王正位,清华大学,北京市,1100.0, 朱武祥; 赵冬青,2008-12-01,F
7037,现金流、融资约束与企业投资行为——基于制造行业细分竞争市场的研究,南开经济研究,经济与管理,天津市,1200,何青,南开大学,天津市,1200.0, 王冲,2008-12-01,F;F
7038,异质性、经济增长与收入不平等,南开经济研究,经济与管理,天津市,1200,李宾,北京大学,北京市,1100.0, 金一; 曾志雄,2008-10-01,F;F
7039,需求因素、技术创新与产业结构演变,南开经济研究,经济与管理,天津市,1200,孙军,南京大学,南京市,3201.0,,2008-10-01,F;F;F
7040,收购方经理人代理问题的企业特征分析——基于中国上市公司并购活动的经验研究,南开经济研究,经济与管理,天津市,1200,陶军,中国人民大学,北京市,1100.0,,2008-10-01,F;F
7041,人民币内向实际汇率均衡水平与错位程度测算:1997—2007,南开经济研究,经济与管理,天津市,1200,陈浪南,中山大学,广州市,4401.0, 陈云,2008-10-01,F
7042,银行卡刷卡消费价格结构研究,南开经济研究,经济与管理,天津市,1200,杨涛,西安交通大学,西安市,6101.0, 张成虎,2008-10-01,F
7043,基于投资视角的我国寿险需求实证研究,南开经济研究,经济与管理,天津市,1200,朱铭来,南开大学,天津市,1200.0, 房予铮,2008-10-01,F;F
7044,日本农地流转的就业缓冲和增收致富功能分析,南开经济研究,经济与管理,天津市,1200,杨国新,南开大学,天津市,1200.0,,2008-08-01,F;F
7045,开发性金融理论问题研究——弥补政策性金融的开发性金融,南开经济研究,经济与管理,天津市,1200,李志辉,南开大学,天津市,1200.0, 王永伟,2008-08-01,F
7046,渠道势力、纵向压榨与过度投资,南开经济研究,经济与管理,天津市,1200,周勤,东南大学,南京市,3201.0, 黄亦然,2008-08-01,F;F
7047,美国经济增长的动力结构与美元均衡汇率,南开经济研究,经济与管理,天津市,1200,刘喜和,天津财经大学,天津市,1200.0,,2008-08-01,F;F;F
7048,纺织业FDI在中国大陆区位选择影响因素的经验分析——基于外资不同来源地和地区差异的视角,南开经济研究,经济与管理,天津市,1200,孙江永,南开大学,天津市,1200.0,,2008-08-01,F;F;F
7049,我国城市科技创新能力的实证研究,南开经济研究,经济与管理,天津市,1200,孙钰,天津商业大学,天津市,1200.0, 李泽涛; 马瑞,2008-08-01,F;G;F
7050,在范式转换中探寻“宏观经济学的微观基础”——一个基于马克思经济学研究视角的理论解析,南开经济研究,经济与管理,天津市,1200,王璐,南开大学,天津市,1200.0, 柳欣,2008-06-01,F
7051,财富效用、生产外部性与经济增长——中国宏观经济典型特征研究,南开经济研究,经济与管理,天津市,1200,邹卫星,天津财经大学,天津市,1200.0, 房林,2008-06-01,F;F
7052,产品差异度与厂商共谋行为——模型与实验证据,南开经济研究,经济与管理,天津市,1200,李建标,南开大学,天津市,1200.0, 于娟; 王光荣; 巨龙,2008-06-01,F;F
7053,国际直接投资消减国际冲突的实证分析,南开经济研究,经济与管理,天津市,1200,蔡洁,华中师范大学,武汉市,4201.0, 周世民,2008-06-01,F
7054,论过渡性制度安排,南开经济研究,经济与管理,天津市,1200,周冰,南开大学,天津市,1200.0, 黄卫华; 商晨,2008-04-01,D
7055,非对称信息下的卡尔多-希克斯改进,南开经济研究,经济与管理,天津市,1200,孙蕾,上海财经大学,上海市,3100.0,,2008-04-01,F
7056,储蓄、投资与经济增长之间的动态相关性研究——基于中国1952-2006年的数据分析,南开经济研究,经济与管理,天津市,1200,汪伟,上海财经大学,上海市,3100.0,,2008-04-01,F;F;F
7057,流通股股东在股权分置改革中是否获得了财富增值?,南开经济研究,经济与管理,天津市,1200,吴德胜,南开大学,天津市,1200.0, 吕斐适; 于善辉,2008-04-01,F
7058,以贵州铜仁地区为例的无担保小额贷款简化分析,南开经济研究,经济与管理,天津市,1200,朱宪辰,南京理工大学,南京市,3201.0, 高岳; 吴函阳,2008-04-01,F;F
7059,近代中国农民生活水平分析,南开经济研究,经济与管理,天津市,1200,王玉茹,南开大学,天津市,1200.0, 李进霞,2008-02-01,F
7060,金融约束、代理成本假说与企业投资行为——来自中国上市公司的经验证据,南开经济研究,经济与管理,天津市,1200,马君潞,南开大学,天津市,1200.0, 李泽广; 王群勇,2008-02-01,F;F
7061,地方财政支农、农村税费改革与农户投资——基于26个省动态面板数据的实证分析,南开经济研究,经济与管理,天津市,1200,李琴,华南农业大学,广州市,4401.0, 李大胜; 余建斌,2008-02-01,F;F
7062,基于主成分构造框架下的我国实际汇率均衡机制研究,南开经济研究,经济与管理,天津市,1200,李宏,天津财经大学,天津市,1200.0, 陆建明,2008-02-01,F;F
7063,外商直接投资对中国东、中、西部地区经济增长作用机制的差异——1990-2004年地区数据的实证检验,南开经济研究,经济与管理,天津市,1200,郭志仪,兰州大学,兰州市,6201.0, 杨曦,2008-02-01,F;F;F
7064,股价会受股票名称影响吗?——基于行为金融学的调查研究,南开经济研究,经济与管理,天津市,1200,刘亚琴,上海财经大学,上海市,3100.0,,2008-02-01,F;F
7066,制度变迁中的中国农地产权的性质:一个历史分析视角,南开经济研究,经济与管理,天津市,1200,邓宏图,南开大学,天津市,1200.0, 崔宝敏,2007-12-01,F
7067,董事会独立性和有效性的动态分析,南开经济研究,经济与管理,天津市,1200,李汉军,中央财经大学,北京市,1100.0, 张俊喜,2007-12-01,F
7068,银行资本充足率监管对宏观经济的影响——基于亚洲地区的实证研究,南开经济研究,经济与管理,天津市,1200,刘澜飚,南开大学,天津市,1200.0, 范小云; 彭砚,2007-12-01,F
7069,大股东制衡、违规行为与外部监管——来自2004-2005年上市公司的证据,南开经济研究,经济与管理,天津市,1200,唐跃军,复旦大学,上海市,3100.0,,2007-12-01,F;F
7070,相邻城市竞争、合作与双赢机制研究,南开经济研究,经济与管理,天津市,1200,安虎森,南开大学,天津市,1200.0, 邹璇,2007-10-01,F
7071,晋升激励、宏观调控与经济周期：一个政治经济学框架,南开经济研究,经济与管理,天津市,1200,刘瑞明,西北大学,西安市,6101.0, 白永秀,2007-10-01,F
7072,国际贸易摩擦南北不对称与摩擦的形成——基于一个三国贸易模型的分析,南开经济研究,经济与管理,天津市,1200,尹翔硕,复旦大学,上海市,3100.0, 李春顶,2007-10-01,F
7073,DEA模型与外商直接投资的行业效率分析,南开经济研究,经济与管理,天津市,1200,金相郁,南开大学,天津市,1200.0, 马丽,2007-10-01,F;F
7074,国内市场分割及其影响因素的实证分析——以我国商品市场为例,南开经济研究,经济与管理,天津市,1200,范爱军,山东大学,济南市,3701.0, 李真; 刘小勇,2007-10-01,F
7075,全要素生产率与区域经济增长的动力——基于对1995—2004年28个省市大中型工业的非参数生产前沿分析,南开经济研究,经济与管理,天津市,1200,涂正革,华中师范大学,武汉市,4201.0,,2007-08-01,F
7076,中国经济波动的动态化特征事实——基于动态条件相关系数的理论和实证,南开经济研究,经济与管理,天津市,1200,杨光,南开大学,天津市,1200.0,,2008-06-01,F;F
7078,异质网络效应、技术进步及社会福利,南开经济研究,经济与管理,天津市,1200,彭恒文,复旦大学,上海市,3100.0, 石磊,2008-04-01,C
7079,“亲亲不能相隐”的经济学分析——兼论“亲亲相隐”于民间法的归隐,南开经济研究,经济与管理,天津市,1200,蔡昱,天津医科大学,天津市,1200.0, 龚刚,2008-04-01,D
7080,产权保护:公共物品?  私有物品?,南开经济研究,经济与管理,天津市,1200,江曙霞,厦门大学,厦门市,3502.0, 谢杰斌,2008-04-01,F;F
7081,审批、谈判与反公共地悲剧,南开经济研究,经济与管理,天津市,1200,应千伟,中山大学,广州市,4401.0, 张光南,2008-04-01,F;F
7083,网络标准竞争的共存均衡与厂商的兼容策略,南开经济研究,经济与管理,天津市,1200,邢宏建,山东大学,济南市,3701.0, 臧旭恒,2008-02-01,F
7084,产业空间集中影响因素探究——基于天津滨海新区制造业32个产业的面板数据分析,南开经济研究,经济与管理,天津市,1200,江曼琦,南开大学,天津市,1200.0, 张志强,2008-02-01,F;F
7085,信息成本与国际贸易:亚洲华商网络与ICT对中国对外贸易影响的面板数据分析,南开经济研究,经济与管理,天津市,1200,蒙英华,厦门大学,厦门市,3502.0, 黄建忠,2008-02-01,F;F;F
7086,二元结构下的人民币均衡汇率理论,南开经济研究,经济与管理,天津市,1200,郑祖玄,河南大学,开封市,4102.0,,2008-02-01,F;F
7087,外国直接投资的行业内与行业间溢出效应:哪些行业受益?,南开经济研究,经济与管理,天津市,1200,薛漫天,东南大学,南京市,3201.0, 赵曙东,2008-02-01,F;F
7088,政策可信性变动、通胀预期形成方式和菲利普斯曲线的稳定性——来自中国的经验证据,南开经济研究,经济与管理,天津市,1200,张勇,华南师范大学,广州市,4401.0,,2008-02-01,F;F
7089,Nash谈判解的预测能力——中国被试的实验证据,南开经济研究,经济与管理,天津市,1200,李建标,南开大学,天津市,1200.0, 李晓义; 孙娟; 祁艳玲,2007-12-01,F
7090,游说、权力分配与制度变迁——以1978年中国农村土地产权制度变迁为例,南开经济研究,经济与管理,天津市,1200,孙圣民,山东大学,济南市,3701.0,,2007-12-01,F
7091,我国产业集聚原因的探讨——基于区域效应、集聚效应、空间成本的新视角,南开经济研究,经济与管理,天津市,1200,何雄浪,宜宾学院,宜宾市,5115.0, 李国平; 杨继瑞,2007-12-01,F
7092,盈余管理与控制性大股东的“隧道行为”——来自配股公司的证据,南开经济研究,经济与管理,天津市,1200,张祥建,上海财经大学,上海市,3100.0, 郭岚,2007-12-01,F
7093,清末至民国前期银企关系探究——以天津恒源纱厂与银行的关系为中心,南开经济研究,经济与管理,天津市,1200,龚关,南开大学,天津市,1200.0,,2007-12-01,F;F
7094,制度与增长：理论解释及中国的经验,南开经济研究,经济与管理,天津市,1200,单豪杰,南京大学,南京市,3201.0, 沈坤荣,2007-10-01,C
7095,基于样本分位数的波动率估计：条件自回归拟极差模型,南开经济研究,经济与管理,天津市,1200,周杰,西安电子科技大学,西安市,6101.0, 刘三阳; 邵锡栋,2007-10-01,F
7096,基于网络层次分析法的物流外包满意度评价方法研究,南开经济研究,经济与管理,天津市,1200,许国兵,北京交通大学,北京市,1100.0, 张文杰,2007-10-01,F;F
7097,外商直接投资与我国技术进步——基于关联渠道分析的实证检验,南开经济研究,经济与管理,天津市,1200,张亚斌,湖南大学,长沙市,4301.0, 肖竞成; 艾洪山,2007-10-01,F
7098,新兴市场国家金融部门外国直接投资：文献综述,南开经济研究,经济与管理,天津市,1200,项卫星,吉林大学,长春市,2201.0, 王达,2007-10-01,F
7099,产权理论遭遇的挑战及其演变——基于2000年以来的最新文献,南开经济研究,经济与管理,天津市,1200,聂辉华,中国人民大学,北京市,1100.0, 杨其静,2007-08-01,F
7100,中间品进口对我国制造业行业人均产出的影响——对1999—2003年28个行业的实证研究,南开经济研究,经济与管理,天津市,1200,王苍峰,上海财经大学,上海市,3100.0,,2007-08-01,F
7101,从古典到现代:制度演化与企业成长中的企业家角色,南开经济研究,经济与管理,天津市,1200,孙早,西安交通大学,西安市,6101.0, 赵国栋,2007-08-01,F
7102,忠诚与集体行动的实现——以温州烟具协会的反倾销诉讼为案例,南开经济研究,经济与管理,天津市,1200,皮建才,北京大学,北京市,1100.0,,2007-08-01,F
7103,是否存在出口外溢的结构性差异——多部门外溢模型及实证,南开经济研究,经济与管理,天津市,1200,包群,南开大学,天津市,1200.0,,2007-08-01,F;F
7104,指令驱动型市场、非公开信息与中国证券收益率,南开经济研究,经济与管理,天津市,1200,杨栋,中国人民大学,北京市,1100.0, 郭玉清,2007-08-01,F;F
7105,空间双寡头竞争下的创新扩散——基于博弈论的模型,南开经济研究,经济与管理,天津市,1200,王飞,中央民族大学,北京市,1100.0,,2007-06-01,F
7106,影响自主创新的因素——基于BACE方法对中国省际数据的分析,南开经济研究,经济与管理,天津市,1200,贺京同,南开大学,天津市,1200.0, 李峰,2007-06-01,F;F
7107,我国工业部门关税保护的动因结构、效应和优化——基于新政治经济学的经验分析,南开经济研究,经济与管理,天津市,1200,黄建忠,厦门大学,厦门市,3502.0, 王俊霖,2007-06-01,F
7108,中国金融发展与对外贸易比较优势关系的经验分析——一种外部融资支持的视角,南开经济研究,经济与管理,天津市,1200,朱彤,南开大学,天津市,1200.0, 郝宏杰; 秦丽,2007-06-01,F;F;F
7109,本币升值的通货紧缩效应:理论审视和对中国的检验,南开经济研究,经济与管理,天津市,1200,陈晓莉,山东大学,济南市,3701.0,,2007-06-01,F;F
7110,外部性与重工业优先发展,南开经济研究,经济与管理,天津市,1200,姚洋,北京大学,北京市,1100.0, 郑东雅,2007-04-01,F;F
7111,供给推动——论经济增长方式转型中的财政政策,南开经济研究,经济与管理,天津市,1200,龚刚,清华大学,北京市,1100.0, 陈琳,2007-04-01,F
7112,令人瞠目的不同世界:西欧与中国近代早期的国家与经济,南开经济研究,经济与管理,天津市,1200,傅瑞斯,荷兰莱顿大学,国外,9000.0, 李晶,2007-04-01,F;F
7113,货币政策立场指示器的实证研究——来自我国货币政策操作实践的证据,南开经济研究,经济与管理,天津市,1200,索彦峰,南京大学,南京市,3201.0, 范从来,2007-04-01,F;F
7114,二元经济条件下的结构调整与经济增长,南开经济研究,经济与管理,天津市,1200,郎永清,南开大学,天津市,1200.0,,2007-04-01,F;F
7115,人民币实际汇率弹性的非对称性研究:基于中国与G-7各国双边贸易数据的实证分析,南开经济研究,经济与管理,天津市,1200,陈六傅,南京大学,南京市,3201.0, 钱学锋,2007-02-01,F;F
7116,34个城市的住宅财富效应:基于panel data的实证研究,南开经济研究,经济与管理,天津市,1200,高春亮,北京大学,北京市,1100.0, 周晓艳,2007-02-01,F;F
7117,预期、机会主义与股东行为均衡,南开经济研究,经济与管理,天津市,1200,刘逊,西安交通大学,西安市,6101.0, 郑飞虎,2007-02-01,F;F
7118,农民的收入差距与人力资本投资研究,南开经济研究,经济与管理,天津市,1200,靳卫东,南京大学,南京市,3201.0,,2007-02-01,F;F
7119,改革以来中国省际农业生产率的收敛性分析,南开经济研究,经济与管理,天津市,1200,赵蕾,南京农业大学,南京市,3201.0, 杨向阳; 王怀明,2007-02-01,F;F
7120,外商直接投资对我国产业结构影响的实证分析——基于面板数据模型的研究,南开经济研究,经济与管理,天津市,1200,刘宇,南开大学,天津市,1200.0,,2007-02-01,F;F;F
7121,费尔普斯对宏观经济学的贡献,南开经济研究,经济与管理,天津市,1200,谭旭东,厦门大学,厦门市,3502.0,,2007-02-01,F;F
7122,博弈中的利他倾向、认知层级和有限信心——一个基于问卷的调查研究,南开经济研究,经济与管理,天津市,1200,钟伟锋,香港大学,香港,8100.0, 徐宗玲,2006-12-01,F
7123,技术进步的原因和性质——基于分工和报酬递增的研究,南开经济研究,经济与管理,天津市,1200,董林辉,南开大学,天津市,1200.0, 段文斌,2006-12-01,F
7124,1996—2005年中国农业剩余劳动力的估算——基于随机前沿模型的分析,南开经济研究,经济与管理,天津市,1200,郭金兴,南开大学,天津市,1200.0,,2007-08-01,F
7125,实际汇率对跨国公司海外子公司股权结构的影响——基于公司数据的经验分析,南开经济研究,经济与管理,天津市,1200,邱立成,南开大学,天津市,1200.0, 王自锋,2007-08-01,F
7126,预算软约束、企业财务风险与审计定价,南开经济研究,经济与管理,天津市,1200,江伟,暨南大学,广州市,4401.0, 李斌,2007-08-01,F
7127,新古典增长模型:一个重新表述,南开经济研究,经济与管理,天津市,1200,黎德福,同济大学,上海市,3100.0, 黄玖立,2007-08-01,F
7128,货币政策与资产价格:经典理论、美联储实践及现实思考,南开经济研究,经济与管理,天津市,1200,伍戈,中国人民银行,北京市,1100.0,,2007-08-01,F;F
7129,经济转型期中国能源需求的长期均衡及短期波动:1978—2005,南开经济研究,经济与管理,天津市,1200,周建,上海财经大学,上海市,3100.0,,2007-06-01,F
7130,政府干预、自然资源与经济增长:基于中国地区层面的研究,南开经济研究,经济与管理,天津市,1200,邓可斌,广东外语外贸大学,广州市,4401.0, 丁菊红,2007-06-01,F
7131,多维技术溢出效应、本土企业创新动力与产业升级的路径选择——基于中国地方产业集群形态的研究,南开经济研究,经济与管理,天津市,1200,张杰,南京大学,南京市,3201.0, 张少军; 刘志彪,2007-06-01,F
7132,能源税对国际贸易与环境污染影响的实证研究,南开经济研究,经济与管理,天津市,1200,张为付,南京财经大学,南京市,3201.0, 潘颖,2007-06-01,F;F;X
7133,国有商业银行股份制改革:一个制度经济学视角,南开经济研究,经济与管理,天津市,1200,刘鹏,中国人民大学,北京市,1100.0, 温彬,2007-06-01,F
7134,国际贸易与劳动力市场:研究述评,南开经济研究,经济与管理,天津市,1200,周申,南开大学,天津市,1200.0, 李春梅; 谢娟娟,2007-06-01,F;F
7135,中国宏观健康生产函数:理论与实证,南开经济研究,经济与管理,天津市,1200,王俊,中央财经大学,北京市,1100.0, 昌忠泽,2007-04-01,F;F
7136,电信市场演化与政府管制——基于随机试验的模型分析,南开经济研究,经济与管理,天津市,1200,王斌,厦门大学,厦门市,3502.0, 蔡宏波,2007-04-01,F;F
7137,日本市场经济的演进:从幕藩到明治维新,南开经济研究,经济与管理,天津市,1200,雷鸣,南开大学,天津市,1200.0,,2007-04-01,F
7138,农产品批发市场购销商客户关系形成机制研究,南开经济研究,经济与管理,天津市,1200,王志刚,中国人民大学,北京市,1100.0, 马建蕾,2007-04-01,F;F
7139,协整还是协变:来自中国进出口时间序列的经验证据(1950—2004),南开经济研究,经济与管理,天津市,1200,栾惠德,南开大学,天津市,1200.0, 张晓峒,2007-04-01,F;F
7140,虚拟经济的波动特征与演化路径——基于复杂性科学的研究,南开经济研究,经济与管理,天津市,1200,王爱俭,天津财经大学,天津市,1200.0, 温博慧,2007-02-01,F;F
7141,我国上市公司信息披露质量的实证研究,南开经济研究,经济与管理,天津市,1200,张宗新,复旦大学,上海市,3100.0, 朱伟骅,2007-02-01,F;F
7142,中小企业融资的开发性金融支持(DFS)模式分析,南开经济研究,经济与管理,天津市,1200,李志辉,南开大学,天津市,1200.0, 李萌,2007-02-01,F;F
7143,劳动力市场分割下的中国农村劳动力流动模型,南开经济研究,经济与管理,天津市,1200,李芝倩,南京大学,南京市,3201.0,,2007-02-01,F;F
7144,跨国银行对外投资模式选择的博弈分析——一个发展中国家的东道国视角,南开经济研究,经济与管理,天津市,1200,刘振宇,南开大学,天津市,1200.0,,2007-02-01,F;F
7145,市场结构如何影响R&D投入?——基于中国制造业行业面板数据的实证分析,南开经济研究,经济与管理,天津市,1200,陈羽,华南理工大学,广州市,4401.0, 李小平; 白澎,2007-02-01,F;F
7146,休闲时间与经济效率——来自OECD国家的证据,南开经济研究,经济与管理,天津市,1200,魏翔,中国人民大学,北京市,1100.0,,2006-12-01,F
7147,随机增长模型下的税收效应,南开经济研究,经济与管理,天津市,1200,王雪标,东北财经大学,大连市,2102.0, 王莉,2006-12-01,F;F
7148,国际技术扩散与经济增长:收敛模型,南开经济研究,经济与管理,天津市,1200,李平,山东理工大学,淄博市,3703.0, 随洪光,2006-12-01,F
7149,社区性组织与过渡性制度安排——中国乡镇企业的制度属性探讨,南开经济研究,经济与管理,天津市,1200,周冰,南开大学,天津市,1200.0, 谭庆刚,2006-12-01,F
7150,韩国经济结构变化的因素分析,南开经济研究,经济与管理,天津市,1200,金继红,北京师范大学,北京市,1100.0,,2006-12-01,F
7151,盈余管理的原因、动机及测度方法前沿研究综述,南开经济研究,经济与管理,天津市,1200,张祥建,上海财经大学,上海市,3100.0, 徐晋,2006-12-01,F
7152,国际垂直专业化分工与贸易:研究综述,南开经济研究,经济与管理,天津市,1200,胡昭玲,南开大学,天津市,1200.0,,2006-10-01,F
7153,外商直接投资对东道国收入分配影响的长期效应:以中国为例,南开经济研究,经济与管理,天津市,1200,周华,同济大学,上海市,3100.0,,2006-10-01,F;F
7154,为了控制收入差距的共识:经济学贡献了什么?,南开经济研究,经济与管理,天津市,1200,陆铭,复旦大学,上海市,3100.0, 王亦琳; 章元,2006-10-01,F
7155,股权改革的三阶段托宾q效应,南开经济研究,经济与管理,天津市,1200,丁守海,中国人民大学,北京市,1100.0,,2006-10-01,F
7156,块状世界的经济学——空间经济学点评,南开经济研究,经济与管理,天津市,1200,安虎森,南开大学,天津市,1200.0, 蒋涛,2006-10-01,F
7157,我国保险业竞争力诊断指标体系及其应用,南开经济研究,经济与管理,天津市,1200,王成辉,南开大学,天津市,1200.0, 江生忠,2006-10-01,F;F
7158,竞争、生产率外溢与东道国的产业发展,南开经济研究,经济与管理,天津市,1200,冼国明,南开大学,天津市,1200.0, 文东伟,2006-08-01,F
