,title,mag_name,mag_classn,mag_city,mag_city_code,author_first,author_unit_first,unit_city,unit_city_code,coauthor,ym,class_num
1986,数字崇拜下的金融资产价格异象,经济研究,经济与管理,北京市,1100,赵静梅,西南财经大学,成都市,5101.0, 吴风云,2009-06-01,F;F
1987,非正规就业者的未来,经济研究,经济与管理,北京市,1100,吴要武,中国社会科学院,北京市,1100.0,,2009-07-01,F
1989,地区竞争格局演变下的中国转轨:财政激励和发展模式反思,经济研究,经济与管理,北京市,1100,陶然,中国科学院,北京市,1100.0, 陆曦; 苏福兵; 汪晖,2009-07-01,F
1990,结构改革与中国工业增长,经济研究,经济与管理,北京市,1100,张军,复旦大学,上海市,3100.0, 陈诗一; Gary H.Jefferson,2009-07-01,F;F
1991,财政政策非线性效应及其解释——兼论巴罗-格罗斯曼宏观一般非均衡模型在中国的适用性,经济研究,经济与管理,北京市,1100,王立勇,中央财经大学,北京市,1100.0, 刘文革,2009-07-01,F;F
1992,人民银行铸币税的测算和运用:1986—2008,经济研究,经济与管理,北京市,1100,张健华,中国人民银行,北京市,1100.0, 张怀清,2009-07-01,F;F
1993,市场潜力的边界效应与内外部市场一体化,经济研究,经济与管理,北京市,1100,赵永亮,暨南大学,广州市,4401.0, 才国伟,2009-07-01,F;F
1994,内外失衡背景下中国宏观经济政策选择——2009年中国经济增长与周期高峰论坛年会综述,经济研究,经济与管理,北京市,1100,张连城,首都经济贸易大学,北京市,1100.0, 周明生,2009-08-01,F
1995,中国二元经济问题研究的一部新作——评陈宗胜等著《中国二元经济结构与农村经济增长和发展》,经济研究,经济与管理,北京市,1100,杨敬年,南开大学,天津市,1200.0,,2009-08-01,F
1996,信任、交易成本与商业信用模式,经济研究,经济与管理,北京市,1100,刘凤委,上海国家会计学院,上海市,3100.0, 李琳; 薛云奎,2009-08-01,F;F
1997,中国经济的内外均衡与财税改革,经济研究,经济与管理,北京市,1100,樊纲,中国经济改革研究基金会,北京市,1100.0, 魏强; 刘鹏,2009-08-01,F;F
1998,一个基于金融稳定的外汇储备分析框架——兼论中国外汇储备的适度规模,经济研究,经济与管理,北京市,1100,李巍,华东师范大学,上海市,3100.0, 张志超,2009-08-01,F
1999,中国保险机构资金运用效率研究:基于资源型两阶段DEA模型,经济研究,经济与管理,北京市,1100,黄薇,对外经济贸易大学,北京市,1100.0,,2009-08-01,F;F
2001,谁进入了高收入行业?——关系、户籍与生产率的作用,经济研究,经济与管理,北京市,1100,陈钊,复旦大学,上海市,3100.0, 陆铭; 佐藤宏,2009-10-01,F
2002,中国宏观经济走势分析的逻辑与方法探讨,经济研究,经济与管理,北京市,1100,刘迎秋,中国社会科学院,北京市,1100.0,,2009-09-01,F;F
2003,中国产业升级的大国雁阵模型分析,经济研究,经济与管理,北京市,1100,蔡昉,中国社会科学院,北京市,1100.0, 王德文; 曲玥,2009-09-01,F;F
2004,职业技能培训对农村居民非农收入的影响,经济研究,经济与管理,北京市,1100,王海港,中央财经大学,北京市,1100.0, 黄少安; 李琴; 罗凤金,2009-09-01,F;F
2005,国有股权、税收优惠与公司税负,经济研究,经济与管理,北京市,1100,吴联生,北京大学,北京市,1100.0,,2009-10-01,F;F
2007,增值税与营业税的福利效应研究,经济研究,经济与管理,北京市,1100,平新乔,北京大学,北京市,1100.0, 梁爽; 郝朝艳; 张海洋; 毛亮,2009-09-01,F
2008,基于省际面板的财政支出与通货膨胀关系研究,经济研究,经济与管理,北京市,1100,赵文哲,中国人民大学,北京市,1100.0, 周业安,2009-10-01,F;F;F
2009,我国上市商业银行全要素生产率的实证分析,经济研究,经济与管理,北京市,1100,蔡跃洲,中国社会科学院,北京市,1100.0, 郭梅军,2009-09-01,F;F
2010,金融资本形成与经济增长,经济研究,经济与管理,北京市,1100,王定祥,西南大学,重庆市,5000.0, 李伶俐; 冉光和,2009-09-01,F;F;F
2011,城乡收入差距变动及其对经济效率的影响,经济研究,经济与管理,北京市,1100,田新民,首都经济贸易大学,北京市,1100.0, 王少国; 杨永恒,2009-07-01,F;F
2012,企业生产率增长及来源:创新还是需求拉动,经济研究,经济与管理,北京市,1100,刘小玄,中国社会科学院,北京市,1100.0, 吴延兵,2009-07-01,F;F
2013,货币政策透明度与反通货膨胀,经济研究,经济与管理,北京市,1100,张鹤,中国人民大学,北京市,1100.0, 张代强; 姚远; 张鹏,2009-07-01,F;F
2014,投资者保护与上市公司资本结构,经济研究,经济与管理,北京市,1100,沈艺峰,厦门大学,厦门市,3502.0, 肖珉; 林涛,2009-07-01,F;F
2015,高等教育改革、预防性储蓄与居民消费行为,经济研究,经济与管理,北京市,1100,杨汝岱,湘潭大学,湘潭市,4303.0, 陈斌开,2009-08-01,G
2016,医疗信任商品的信号博弈分析,经济研究,经济与管理,北京市,1100,黄涛,北京大学,北京市,1100.0, 颜涛,2009-08-01,R
2017,经济地理与地区间工资差异,经济研究,经济与管理,北京市,1100,范剑勇,复旦大学,上海市,3100.0, 张雁,2009-08-01,F;F
2018,工农业关系与经济发展:计划经济时代的历史计量学再考察——兼与姚洋、郑东雅商榷,经济研究,经济与管理,北京市,1100,孙圣民,山东大学,济南市,3701.0,,2009-08-01,F;F;F
2019,我国本土制造业企业出口决定因素的实证分析,经济研究,经济与管理,北京市,1100,刘志彪,南京大学,南京市,3201.0, 张杰,2009-08-01,F;F;F
2020,经济发展中的最优金融结构理论初探,经济研究,经济与管理,北京市,1100,林毅夫,世界银行,国外,9000.0, 孙希芳; 姜烨,2009-08-01,F
2021,基于R~2的中国股市私有信息套利分析,经济研究,经济与管理,北京市,1100,冯用富,西南财经大学,成都市,5101.0, 董艳; 袁泽波; 杨仁眉,2009-08-01,F;F
2022,中国城市与区域经济增长的扩散回流与市场区效应,经济研究,经济与管理,北京市,1100,柯善咨,湖南大学,长沙市,4301.0,,2009-08-01,F;F;F
2023,增强惩罚能力的若干社会机制与群体合作秩序的维持,经济研究,经济与管理,北京市,1100,韦倩,山东大学,济南市,3701.0,,2009-10-01,C
2024,西部少数民族地区人力资源评价及开发研究,经济研究,经济与管理,北京市,1100,杨林,云南师范大学,昆明市,5301.0, 武友德; 骆华松; 常志有; 薛勇军,2009-10-01,F
2025,1600—1840年中国国内生产总值的估算,经济研究,经济与管理,北京市,1100,刘逖,复旦大学,上海市,3100.0,,2009-10-01,F
2026,公共教育政策、经济增长与人力资本溢价,经济研究,经济与管理,北京市,1100,郭庆旺,中国人民大学,北京市,1100.0, 贾俊雪,2009-10-01,G;F;F
2027,西部大开发成效与中国区域经济收敛,经济研究,经济与管理,北京市,1100,刘生龙,清华大学,北京市,1100.0, 王亚华; 胡鞍钢,2009-09-01,F;F;F
2028,企业家的创业与创新精神对中国经济增长的影响,经济研究,经济与管理,北京市,1100,李宏彬,清华大学,北京市,1100.0, 李杏; 姚先国; 张海峰; 张俊森,2009-10-01,F;F
2029,R&D补贴对中国企业自主创新的激励效应,经济研究,经济与管理,北京市,1100,安同良,南京大学,南京市,3201.0, 周绍东; 皮建才,2009-10-01,F;F
2030,接入定价、渠道竞争与规制失败,经济研究,经济与管理,北京市,1100,石奇,南京财经大学,南京市,3201.0, 孔群喜,2009-09-01,F
2031,我国货币政策对通货膨胀与产出的非对称反应,经济研究,经济与管理,北京市,1100,欧阳志刚,华东交通大学,南昌市,3601.0, 王世杰,2009-09-01,F;F
2033,委托代理:经营者行为、会计信息鉴证和投资者,经济研究,经济与管理,北京市,1100,龙小海,昆明理工大学,昆明市,5301.0, 田存志; 段万春,2009-09-01,F
2034,企业异质性、市场进入成本、技术溢出效应与出口参与决定,经济研究,经济与管理,北京市,1100,易靖韬,中国人民大学,北京市,1100.0,,2009-09-01,F;F;F;F
2035,亲社会性行为及其社会偏好的分解,经济研究,经济与管理,北京市,1100,陈叶烽,浙江大学,杭州市,3301.0,,2009-12-01,C
2036,新中国经济学60年的总结与反思——评《新中国经济学60年》,经济研究,经济与管理,北京市,1100,周立群,南开大学,天津市,1200.0,,2009-11-01,F
2037,转轨失衡与经济的短期和长期增长:一个寻租模型,经济研究,经济与管理,北京市,1100,黄少安,山东大学,济南市,3701.0, 赵建,2009-12-01,F
2038,国家资本主义与“中国模式”,经济研究,经济与管理,北京市,1100,"中国社会科学院""国际金融危机与经济学理论反思""课题组",中国社会科学院,北京市,1100.0, 胡乐明; 刘志明; 张建刚,2009-11-01,F
2039,生产率增长与要素再配置效应:中国的经验研究,经济研究,经济与管理,北京市,1100,姚战琪,中国社会科学院,北京市,1100.0,,2009-11-01,F;F
2040,中国城镇居民劳动收入差距演变及其原因:1990—2005,经济研究,经济与管理,北京市,1100,陈斌开,中央财经大学,北京市,1100.0, 杨依山; 许伟,2009-12-01,F;F
2041,土地产权、非农就业机会与农户农业生产投资,经济研究,经济与管理,北京市,1100,钟甫宁,南京农业大学,南京市,3201.0, 纪月清,2009-12-01,F;F;F
2042,社会资本、政治关系与公司投资决策,经济研究,经济与管理,北京市,1100,潘越,厦门大学,厦门市,3502.0, 戴亦一; 吴超鹏; 刘建亮,2009-11-01,F;F
2044,贸易自由化、要素分布和制造业集聚,经济研究,经济与管理,北京市,1100,邓慧慧,中国人民大学,北京市,1100.0,,2009-11-01,F;F;F
2045,国际金融危机与马克思主义,经济研究,经济与管理,北京市,1100,"中国社会科学院""国际金融危机与经济学理论反思""课题组",中国社会科学院,北京市,1100.0, 裴小革,2009-11-01,F;F
2046,出口、外商直接投资与中国制造业就业,经济研究,经济与管理,北京市,1100,毛日昇,中国社会科学院,北京市,1100.0,,2009-11-01,F;F;F;F
2047,中国证券分析师的盈余预测行为有效性研究,经济研究,经济与管理,北京市,1100,郭杰,中国人民大学,北京市,1100.0, 洪洁瑛,2009-11-01,F;F
2048,市场化改革、企业业绩与国有企业经理薪酬,经济研究,经济与管理,北京市,1100,辛清泉,重庆大学,重庆市,5000.0, 谭伟强,2009-11-01,F
2049,交通住房政策效应与生产和人口的过度集中,经济研究,经济与管理,北京市,1100,范红忠,华中科技大学,武汉市,4201.0,,2008-06-01,C
2050,经济发展方式转变与节能减排内在动力,经济研究,经济与管理,北京市,1100,蔡昉,中国社会科学院,北京市,1100.0, 都阳; 王美艳,2008-06-01,F;F;X
2051,企业家人力资本与中国私营企业制度选择和创新,经济研究,经济与管理,北京市,1100,刘剑雄,中国社会科学院,北京市,1100.0,,2008-06-01,F;F;F
2052,治理结构对家族股东隧道行为的影响分析,经济研究,经济与管理,北京市,1100,申明浩,广东外语外贸大学,广州市,4401.0,,2008-06-01,F;F;F
2054,市场结构与我国银行业绩效:假说与检验,经济研究,经济与管理,北京市,1100,徐忠,中国人民银行,北京市,1100.0, 沈艳; 王小康; 沈明高,2009-10-01,F;F
2055,国际金融危机与凯恩斯主义,经济研究,经济与管理,北京市,1100,"中国社会科学院""国际金融危机与经济学理论反思""课题组",中国社会科学院,北京市,1100.0, 杨春学; 谢志刚,2009-11-01,F
2056,现代经济学研究范式与中国社会变革的本土实践——第九届“中国青年经济学者论坛”综述,经济研究,经济与管理,北京市,1100,何杰,西南财经大学,成都市,5101.0, 马骁; 杨丹,2009-12-01,F
2057,国际金融危机与新自由主义的理论反思,经济研究,经济与管理,北京市,1100,"中国社会科学院""国际金融危机与经济学理论反思""课题组",中国社会科学院,北京市,1100.0, 刘迎秋,2009-11-01,F
2058,西方国家应对金融危机的国有化措施分析,经济研究,经济与管理,北京市,1100,"中国社会科学院""国际金融危机与经济学理论反思""课题组",中国社会科学院,北京市,1100.0, 金碚; 刘戒骄,2009-11-01,F
2059,灾难风险与中国城镇居民财产分布,经济研究,经济与管理,北京市,1100,陈彦斌,中国人民大学,北京市,1100.0, 霍震; 陈军,2009-11-01,F;F
2060,强制性技术变迁、不平衡增长与中国经济周期模型,经济研究,经济与管理,北京市,1100,袁江,中国农业银行,北京市,1100.0, 张成思,2009-12-01,F;F
2061,能源价格上涨对中国一般价格水平的影响,经济研究,经济与管理,北京市,1100,林伯强,厦门大学,厦门市,3502.0, 王锋,2009-12-01,F
2062,宏观经济因素与公司资本结构变动,经济研究,经济与管理,北京市,1100,苏冬蔚,暨南大学,广州市,4401.0, 曾海舰,2009-12-01,F;F
2063,探求服务外包与服务全球化真谛——读江小涓等著《服务全球化与服务外包:现状、趋势及理论分析》,经济研究,经济与管理,北京市,1100,卢锋,北京大学,北京市,1100.0,,2009-12-01,F
2065,国际金融危机与国际贸易、国际金融秩序的发展方向,经济研究,经济与管理,北京市,1100,"中国社会科学院""国际金融危机与经济学理论反思""课题组",中国社会科学院,北京市,1100.0, 李向阳,2009-11-01,F;F
2066,背景风险与居民风险金融资产投资,经济研究,经济与管理,北京市,1100,何兴强,中山大学,广州市,4401.0, 史卫; 周开国,2009-12-01,F;F
2067,信贷扩张、监管错配与金融危机:跨国实证,经济研究,经济与管理,北京市,1100,马勇,中国人民大学,北京市,1100.0, 杨栋; 陈雨露,2009-12-01,F;F
2068,知识产权、市场结构、模仿和创新,经济研究,经济与管理,北京市,1100,庄子银,武汉大学,武汉市,4201.0,,2009-11-01,F;F;F
2069,法经济学的理论进展和应用研究——第六届“中国法经济学论坛”综述,经济研究,经济与管理,北京市,1100,史晋川,浙江大学,杭州市,3301.0, 董雪兵,2008-06-01,D
2070,三大增长极对中国内陆地区经济的外溢性影响研究,经济研究,经济与管理,北京市,1100,潘文卿,清华大学,北京市,1100.0, 李子奈,2008-06-01,F
2071,企业演化:中国工业生产率增长的重要途径,经济研究,经济与管理,北京市,1100,李玉红,中国社会科学院,北京市,1100.0, 王皓; 郑玉歆,2008-06-01,F;F
2072,中国上市公司资本结构的影响因素和股权融资偏好,经济研究,经济与管理,北京市,1100,肖泽忠,湘潭大学,湘潭市,4303.0, 邹宏,2008-06-01,F
2074,外商直接投资对内资企业效率的影响和渠道,经济研究,经济与管理,北京市,1100,路江涌,清华大学,北京市,1100.0,,2008-06-01,F;F;F
2075,汇率制度与货币政策——发展中国家和小国经济的思考,经济研究,经济与管理,北京市,1100,龚刚,南开大学,天津市,1200.0, 高坚; 何学中,2008-06-01,F;F;F
2076,不完美信息下序贯决策行为的一项实验考察——关于羊群行为的贝叶斯模型实验检验,经济研究,经济与管理,北京市,1100,朱宪辰,南京理工大学,南京市,3201.0, 李妍绮; 曾华翔,2008-06-01,F;C
2077,认知理性与个体主义方法论的发展,经济研究,经济与管理,北京市,1100,黄凯南,山东大学,济南市,3701.0, 程臻宇,2008-07-01,B
2078,基尼系数组群分解新方法研究:从城乡二亚组到多亚组,经济研究,经济与管理,北京市,1100,程永宏,中国人民大学,北京市,1100.0,,2008-08-01,F;F
2079,中国人口年龄结构和居民消费:1989—2004,经济研究,经济与管理,北京市,1100,李文星,华中科技大学,武汉市,4201.0, 徐长生; 艾春荣,2008-07-01,F;C
2080,中国民营上市公司高管的政府背景与公司价值,经济研究,经济与管理,北京市,1100,吴文锋,上海交通大学,上海市,3100.0, 吴冲锋; 刘晓薇,2008-07-01,F;F
2081,全流通纠正终极控制者利益取向的有效性——来自中国家族上市公司的证据,经济研究,经济与管理,北京市,1100,廖理,清华大学,北京市,1100.0, 张学勇,2008-08-01,F;F
2082,中国外贸进出口商品中的内涵能源及其政策含义,经济研究,经济与管理,北京市,1100,陈迎,中国社会科学院,北京市,1100.0, 潘家华; 谢来辉,2008-07-01,F
2083,中国通货膨胀是工资成本推动型吗?——基于超额工资增长率的实证研究,经济研究,经济与管理,北京市,1100,范志勇,中国人民大学,北京市,1100.0,,2008-08-01,F;F
2084,中国金融资产结构演进:1991—2007,经济研究,经济与管理,北京市,1100,易纲,北京大学,北京市,1100.0, 宋旺,2008-08-01,F
2085,人民币汇率变动对我国价格水平的传递,经济研究,经济与管理,北京市,1100,施建淮,北京大学,北京市,1100.0, 傅雄广; 许伟,2008-07-01,F;F;F
2086,什么决定了中国商业银行的净利差?,经济研究,经济与管理,北京市,1100,周开国,中山大学,广州市,4401.0, 李涛; 何兴强,2008-08-01,F;F
2088,什么影响了居民的社会信任水平?——来自广东省的经验证据,经济研究,经济与管理,北京市,1100,李涛,中国人民大学,北京市,1100.0, 黄纯纯; 何兴强; 周开国,2008-01-01,D
2089,外包与生产率:基于工业行业数据的经验研究,经济研究,经济与管理,北京市,1100,徐毅,南京大学,南京市,3201.0, 张二震,2008-01-01,F
2090,参数异质性、经济趋同与中国区域经济发展,经济研究,经济与管理,北京市,1100,周业安,中国人民大学,北京市,1100.0, 章泉,2008-01-01,F;F
2091,大型国有企业集团公司治理的改革与完善——第七届国有经济论坛综述,经济研究,经济与管理,北京市,1100,邵学峰,吉林大学,长春市,2201.0, 张东明,2008-01-01,F
2092,社会保障基金最优持股比例研究,经济研究,经济与管理,北京市,1100,杨俊,中国人民大学,北京市,1100.0, 龚六堂,2008-06-01,F;F
2093,从事前效率问题到事后效率问题——不完全合同理论的几类经典模型比较,经济研究,经济与管理,北京市,1100,蒋士成,上海交通大学,上海市,3100.0, 费方域,2008-08-01,D
2094,中国居民卫生医疗需求行为研究,经济研究,经济与管理,北京市,1100,王俊,中央财经大学,北京市,1100.0, 昌忠泽; 刘宏,2008-07-01,R
2095,计量经济学应用研究的总体回归模型设定,经济研究,经济与管理,北京市,1100,李子奈,清华大学,北京市,1100.0,,2008-08-01,F
2096,公共品的自愿供给机制:一项实验研究,经济研究,经济与管理,北京市,1100,周业安,中国人民大学,北京市,1100.0, 宋紫峰,2008-07-01,F
2097,转型经济下的中国经济趋同研究——基于非线性时变因子模型的实证分析,经济研究,经济与管理,北京市,1100,何一峰,北京大学,北京市,1100.0,,2008-07-01,F;F
2099,中国工业部门要素分配份额决定因素研究,经济研究,经济与管理,北京市,1100,白重恩,清华大学,北京市,1100.0, 钱震杰; 武康平,2008-08-01,F;F
2100,自主研发、技术引进与生产率——基于中国地区工业的实证研究,经济研究,经济与管理,北京市,1100,吴延兵,中国社会科学院,北京市,1100.0,,2008-08-01,F;F;F
2101,有限赶超与经济增长,经济研究,经济与管理,北京市,1100,杨汝岱,湘潭大学,湘潭市,4303.0, 姚洋,2008-08-01,F;F;F
2102,政府偏好、公共品供给与转型中的财政分权,经济研究,经济与管理,北京市,1100,丁菊红,复旦大学,上海市,3100.0, 邓可斌,2008-07-01,F
2103,浮动本位兑换、双重汇率与中国经济:1870—1900,经济研究,经济与管理,北京市,1100,管汉晖,北京大学,北京市,1100.0,,2008-08-01,F;F
2104,经济转型与外商直接投资技术溢出效应,经济研究,经济与管理,北京市,1100,蒋殿春,南开大学,天津市,1200.0, 张宇,2008-07-01,F;F;F
2105,中国的准备金、准备金税与货币控制:1984—2007,经济研究,经济与管理,北京市,1100,张晓慧,中国人民银行,北京市,1100.0, 纪志宏; 崔永,2008-07-01,F;F;F
2106,经济增长、经济政策与公司业绩关系的实证研究,经济研究,经济与管理,北京市,1100,靳庆鲁,上海财经大学,上海市,3100.0, 李荣林; 万华林,2008-08-01,F;F
2107,服务外包:合约形态变革及其理论蕴意——人力资本市场配置与劳务活动企业配置的统一,经济研究,经济与管理,北京市,1100,江小涓,国务院,北京市,1100.0,,2008-07-01,F
2108,作为人力资本、公共产品和制度的语言:语言经济学的一个基本分析框架,经济研究,经济与管理,北京市,1100,张卫国,山东大学,济南市,3701.0,,2008-02-01,H
2109,从分割到融合:城乡经济增长与社会和谐的政治经济学,经济研究,经济与管理,北京市,1100,陈钊,复旦大学,上海市,3100.0, 陆铭,2008-01-01,F
2110,中国和印度不平衡发展的比较研究,经济研究,经济与管理,北京市,1100,Shubham Chaudhuri,世界银行,国外,9000.0, Martin Ravallion,2008-01-01,F;F
2111,中国私营企业的生产率表现和投资效率,经济研究,经济与管理,北京市,1100,王争,浙江大学,杭州市,3301.0, 史晋川,2008-01-01,F;F
2112,中国生产性服务业的水平、结构及影响——基于投入—产出法的国际比较研究,经济研究,经济与管理,北京市,1100,程大中,复旦大学,上海市,3100.0,,2008-01-01,F;F
2113,理解人民币汇率的均衡、失调、波动与调整,经济研究,经济与管理,北京市,1100,金雪军,浙江大学,杭州市,3301.0, 王义中,2008-01-01,F
2114,最优专利制度、技术进步方向与工资不平等,经济研究,经济与管理,北京市,1100,潘士远,浙江大学,杭州市,3301.0,,2008-01-01,G;F;F
2115,富国之路:长期经济增长的一致理论,经济研究,经济与管理,北京市,1100,陈昆亭,山东大学,济南市,3701.0, 周炎,2008-02-01,F
2116,我国初次分配中的两极分化及成因,经济研究,经济与管理,北京市,1100,徐现祥,中山大学,广州市,4401.0, 王海港,2008-02-01,F
2117,农地制度、土地细碎化与农民收入不平等,经济研究,经济与管理,北京市,1100,许庆,上海财经大学,上海市,3100.0, 田士超; 徐志刚; 邵挺,2008-02-01,F;F
2118,政策性负担与长期预算软约束,经济研究,经济与管理,北京市,1100,龚强,北京大学,北京市,1100.0, 徐朝阳,2008-02-01,F
2119,中国通胀惯性特征与货币政策启示,经济研究,经济与管理,北京市,1100,张成思,中国人民大学,北京市,1100.0,,2008-02-01,F;F
2120,宏观形势谨慎乐观  潜在风险不容忽视——中国经济增长与周期高峰论坛2008年会综述,经济研究,经济与管理,北京市,1100,张连城,首都经济贸易大学,北京市,1100.0, 周明生,2008-09-01,F
2121,全国第二届“马克思主义经济学发展与创新论坛”综述,经济研究,经济与管理,北京市,1100,李建建,福建师范大学,福州市,3501.0, 黄茂兴; 陈晓枫; 陈凤娣; 许彩玲; 黄瑾,2008-09-01,F
2122,松柏长青  学人风范——敬祝骆耕漠先学百年华诞,经济研究,经济与管理,北京市,1100,黄达,中国人民大学,北京市,1100.0,,2008-09-01,F
2123,外部风险对中国地方政府规模的影响,经济研究,经济与管理,北京市,1100,杨灿明,中南财经政法大学,武汉市,4201.0, 孙群力,2008-09-01,F
2124,银行业结构与经济增长,经济研究,经济与管理,北京市,1100,林毅夫,世界银行,国外,9000.0, 孙希芳,2008-09-01,F
2125,人民币升值压力与货币政策:基于货币模型的实证分析,经济研究,经济与管理,北京市,1100,卜永祥,北京大学,北京市,1100.0,,2008-09-01,F;F
2126,噪声交易与市场质量,经济研究,经济与管理,北京市,1100,苏冬蔚,暨南大学,广州市,4401.0,,2008-09-01,F;F
2127,教育投入比与地区经济增长差异,经济研究,经济与管理,北京市,1100,于凌云,西南交通大学,成都市,5101.0,,2008-10-01,G;F;F
2128,中国制造业空间结构变动及其对区域分工的影响,经济研究,经济与管理,北京市,1100,陈秀山,中国人民大学,北京市,1100.0, 徐瑛,2008-10-01,F
2129,"中国货币政策的二元传导机制——“两中介目标,两调控对象”模式研究",经济研究,经济与管理,北京市,1100,盛松成,中国人民银行,北京市,1100.0, 吴培新,2008-10-01,F;F
2130,我国货币—产出非对称影响关系的实证研究,经济研究,经济与管理,北京市,1100,郑挺国,吉林大学,长春市,2201.0, 刘金全,2008-01-01,F;F
2131,FDI对国内企业技术创新影响的理论与实证研究,经济研究,经济与管理,北京市,1100,范承泽,香港岭南大学,香港,8100.0, 胡一帆; 郑红亮,2008-01-01,F;F
2132,契约不完全一定导致投资无效率吗?——一个带有不对称信息的敲竹杠模型,经济研究,经济与管理,北京市,1100,聂辉华,中国人民大学,北京市,1100.0,,2008-02-01,F
2133,环境、资源与工业增长的协调性,经济研究,经济与管理,北京市,1100,涂正革,华中师范大学,武汉市,4201.0,,2008-02-01,F;F
2134,服务全球化的发展趋势和理论分析,经济研究,经济与管理,北京市,1100,江小涓,国务院,北京市,1100.0,,2008-02-01,F
2135,投资者保护、代理成本与公司绩效,经济研究,经济与管理,北京市,1100,王鹏,中国人民银行,北京市,1100.0,,2008-02-01,F
2136,中国民营化的财政动因,经济研究,经济与管理,北京市,1100,韩朝华,中国社会科学院,北京市,1100.0, 戴慕珍,2008-02-01,F
